WO2019145791,PCT/IB2019/000107,29.01.2019,WO/2019/145791,01.08.2019,WO,CHEMICAL SENSING SYSTEM,"A chemical sensing system is described. The chemical sensing system can include a plurality of sensors arranged on at least one substrate. The sensors may have differing sensitivities to sense different analytes, and may each be configured to output a signal in response to sensing one or more of the different analytes. The chemical sensing system can further include a computer processor programmed to receive the signals output from the plurality of sensors. The computer processor may be further programmed to determine a concentration of analytes in the sample based, at least in part, on the received signals and a model relating the signals or information derived from the signals to an output representation having bases corresponding to analytes.",G01N 37/00; G06N 3/02; G06N 3/08,STRATUSCENT INC.,"KHOMAMI ABADI, Mojtaba; GAHROOSI, Amir, Bahador; GOULD, Matthew, V.; MASILAMANI, Ashok, Prabhu","62/623,440 29.01.2018 US",
WO2020068498,PCT/US2019/051624,18.09.2019,WO/2020/068498,02.04.2020,WO,DATA COMPRESSION USING INTEGER NEURAL NETWORKS,"Methods, systems, and apparatus, including computer programs encoded on a computer storage medium, for reliably performing data compression and data decompression across a wide variety of hardware and software platforms by using integer neural networks. In one aspect, there is provided a method for entropy encoding data which defines a sequence comprising a plurality of components, the method comprising: for each component of the plurality of components: processing an input comprising: (i) a respective integer representation of each of one or more components of the data which precede the component in the sequence, (ii) an integer representation of one or more respective latent variables characterizing the data, or (iii) both, using an integer neural network to generate data defining a probability distribution over the predetermined set of possible code symbols for the component of the data.",G06N 3/04; G06N 3/08; H04N 19/00; G06N 3/063,GOOGLE LLC,"JOHNSTON, Nicholas; BALLE, Johannes","62/737,852 27.09.2018 US",
WO2018128653,PCT/US2017/053230,25.09.2017,WO/2018/128653,12.07.2018,WO,SYSTEM AND METHOD FOR DESIGNING SYSTEM ON CHIP (SOC) CIRCUITS THROUGH ARTIFICIAL INTELLIGENCE AND REINFORCEMENT LEARNING,"The embodiments herein discloses a system and method for designing SoC using AI and Reinforcement Learning (RL) techniques. Reinforcement Learning is done either hierarchically in Several steps or in a single-step comprising environment, tasks, agents and experiments, to have access to SoC (System on a Chip) related information. The AI agent is configured to learn from the interaction and plan the implementation of a SoC circuit design, Q values generated for each domain and sub domain are stored in a hierarchical SMDP structure in a form of SMDP Q table in a big data database. An optimal chip architecture corresponding to a maximum Q value of a top level in the SMDP Q table is acquired and stored in a database for learning and inference. Desired SoC configuration is optimized and generated based on the optimal chip architecture and the generated chip specific graph library.",G06F 15/18,ALPHAICS CORPORATION,"NAGARAJA, Nagendra","62/443,803 08.01.2017 US; 15/499,832 27.04.2017 US",JP-2019558330; EP-2017889850
WO2018013200,PCT/US2017/029699,26.04.2017,WO/2018/013200,18.01.2018,WO,DEEP NEURAL NETWORK FOR IRIS IDENTIFICATION,"Systems and methods for iris authentication are disclosed. In one aspect, a deep neural network (DNN) with a triplet network architecture can be trained to learn an embedding (e.g., another DNN) that maps from the higher dimensional eye image space to a lower dimensional embedding space. The DNN can be trained with segmented iris images or images of the periocular region of the eye (including the eye and portions around the eye such as eyelids, eyebrows, eyelashes, and skin surrounding the eye). With the triplet network architecture, an embedding space representation (ESR) of a person's eye image can be closer to the ESRs of the person's other eye images than it is to the ESR of another person's eye image. In another aspect, to authenticate a user as an authorized user, an ESR of the user's eye image can be sufficiently close to an ESR of the authorized user's eye image.",G06K 9/20; G06K 9/40; G06K 9/00; G06K 9/36,"MAGIC LEAP, INC.","SPIZHEVOY, Alexey; KAEHLER, Adrian; BRADSKI, Gary",2016128792 14.07.2016 RU,KR-1020197004054; JP-2019501636; EP-2017828103
WO2019217460,PCT/US2019/031175,07.05.2019,WO/2019/217460,14.11.2019,WO,TECHNIQUES FOR ANALYZING VEHICLE DESIGN DEVIATIONS USING DEEP LEARNING WITH NEURAL NETWORKS,"A design application is configured to generate a latent space representation of a fleet of pre-existing vehicles. The design application encodes vehicle designs associated with the fleet of pre-existing vehicles into the latent space representation to generate a first latent space location. The first latent space location represents the characteristic style associated with the fleet of pre-existing vehicles. The design application encodes a sample design provided by a user into the latent space representation to produce a second latent space location. The design application then determines a distance between the first latent space location and the second latent space location. Based on the distance, the design application generates a style metric that indicates the aesthetic similarity between the sample design and the vehicle designs associated with the fleet of pre-existing vehicles. The design application can also generate new vehicle designs based on the latent space representation and the sample design.",G06F 17/50; G06N 20/00,"AUTODESK, INC.","NAGY, Danil; NOVIELLO, Daniel; STODDART, James; BENJAMIN, David; LAU, Damon","62/668,731 08.05.2018 US; 16/362,555 22.03.2019 US",
WO2006086555,PCT/US2006/004589,08.02.2006,WO/2006/086555,17.08.2006,WO,METHOD AND SYSTEM FOR REDUCING DEPENDENT ELIGIBILITY FRAUD IN HEALTHCARE PROGRAMS,"The present invention provides a system and method for reducing fraud in a healthcare benefits plan using a predictive model to identify those subscribers having a high probability of maintaining an ineligible dependent under the plan. The predictive model may be developed using subscriber data of the subscriber group being analyzed or using a base case subscriber group having certain similarities to the subscriber group being analyzed. In accordance with the present invention an analysis engine receives subscriber data of subscribers in a subscriber group, which includes data of at least one subscriber reported to have maintained an ineligible dependent under the healthcare benefits plan, and develops a predictive model using the subscriber data. A predictive engine applies the subscriber data to the predictive model. A reporting component then uses an output of the predictive model to report a score for at least one subscriber of the healthcare benefits plan, wherein the score indicates a probability that the subscriber is maintaining an ineligible dependent under the healthcare benefits plan.",G06G 7/00; G06Q 10/00; G06Q 50/00; G06Q 90/00,"ROSE, Alan, B.; LU, Jye-Chyi; MASSEY, Susan, G.","ROSE, Alan, B.; LU, Jye-Chyi","60/651,133 08.02.2005 US",
WO2017196689,PCT/US2017/031460,06.05.2017,WO/2017/196689,16.11.2017,WO,DEEP LEARNING OF BOTS THROUGH EXAMPLES AND EXPERIENCE,"Embodiments include methods and systems for using, creating and maintaining goal-oriented, dialog systems (i.e., transactional bots) that provide interfaces to application functionality. The methods and systems of the embodiments provide a bot that may learn in supervised learning and reinforcement learning from conversational examples provided by domain experts and from interaction with users. Conversational bots may be created to interact using both text and/or application programming interface (API) calls. A developer may configure a bot that interfaces with an application back-end where behavior of the bot may be controlled by use of masking actions. A specification for the bot may be flexibly designed to specify how developer code may be organized, for example, as masking operations on the possible actions the bot may execute. Additionally, the methods and systems may automatically infer the best state representation during a dialog so a state variable need not be predefined.",G06N 3/04,"MICROSOFT TECHNOLOGY LICENSING, LLC","WILLIAMS, Jason; ZWEIG, Geoffrey","15/154,017 13.05.2016 US",EP-2017723910
WO2019221985,PCT/US2019/031255,08.05.2019,WO/2019/221985,21.11.2019,WO,SYSTEMS AND METHODS FOR UNIFYING STATISTICAL MODELS FOR DIFFERENT DATA MODALITIES,"Techniques for performing a prediction task using a multi-modal statistical model configured to receive input data from multiple modalities including input data from a first modality and input data from a second modality different from the first modality. The techniques include: obtaining information specifying the multi-modal statistical model including values of parameters of each of multiple components of the multi-modal statistical model, the multiple components including first and second encoders for processing input data for the first and second modalities, respectively, first and second modality embeddings, a joint-modality representation, and a predictor; obtaining first input data for the first data modality; providing the first input data to the first encoder to generate a first feature vector; identifying a second feature vector using the joint-modality representation, the first modality embedding and the first feature vector; and generating a prediction for the prediction task using the predictor and the second feature vector.",G06N 3/04; G06N 3/08,QUANTUM-SI INCORPORATED,"ROTHBERG, Jonathan, M.; ESER, Umut; MEYER, Michael","62/671,068 14.05.2018 US; 62/678,074 30.05.2018 US",
EP242529326,18205548,09.11.2018,3486838,22.05.2019,EP,SYSTEM AND METHOD FOR SEMI-SUPERVISED CONDITIONAL GENERATIVE MODELING USING ADVERSARIAL NETWORKS,"One embodiment facilitates generating synthetic data objects using a semi-supervised GAN. During operation, a generator module synthesizes a data object derived from a noise vector and an attribute label. The system passes, to an unsupervised discriminator module, the data object and a set of training objects which are obtained from a training data set. The unsupervised discriminator module calculates: a value indicating a probability that the data object is real; and a latent feature representation of the data object. The system passes the latent feature representation and the attribute label to a supervised discriminator module. The supervised discriminator module calculates a value indicating a probability that the attribute label given the data object is real. The system performs the aforementioned steps iteratively until the generator module produces data objects with a given attribute label which the unsupervised and supervised discriminator modules can no longer identify as fake.",G06K 9/46; G06K 9/62,PALO ALTO RES CT INC,KALLUR PALLI KUMAR SRICHARAN; BALA RAJA; SUN JIN; DING HUI; SHREVE MATTHEW A,201715826613 29.11.2017 US; 201762586786 15.11.2017 US,
WO2018189589,PCT/IB2018/000472,12.04.2018,WO/2018/189589,18.10.2018,WO,DOCUMENT CLASSIFICATION USING MACHINE LEARNING,"Disclosed herein are embodiments of systems, devices, and methods automated document analysis and processing using machine leaming techniques. In one embodiment, systems and methods are disclosed for automatically classifying documents. In another embodiment, systems and methods are disclosed for identifying new tags for untagged documents. In another embodiment, systems and methods are disclosed for identifying documents related to a target document.",G06F 17/27; G06F 17/30,"NOVABASE BUSINESS SOLUTIONS, S.A.","LEAL, Joao; DE FATIMA MACHADO DIAS, Maria; PINTO, Sara; VERRUMA, Pedro; ANTUNES, Bruno; GOMES, Paulo","15/950,537 11.04.2018 US; 62/485,428 14.04.2017 US",
EP82196144,11816334,02.08.2011,2605153,19.06.2013,EP,"INFORMATION PROCESSING DEVICE, METHOD OF PROCESSING INFORMATION, AND PROGRAM","The present invention relates to an information processing device, an information processing method, and a program capable of easily adding an annotation to content and providing an application, which utilizes the annotation.  A learning device 312 extracts an image feature amount of each frame of an image of learning content and extracts word frequency information regarding a frequency of appearance of each word in a description text describing a content of the image of the learning content as a text feature amount of the description text, and learns an annotation model, which is a multi-stream HMM, by using a multi-stream including the image feature amount and the text feature amount. A browsing control device 314 extracts a scene, which is a group of one or more temporally continuous frames, from target content by using the annotation model and displays representative images of the scenes so as to be arranged in chronological order. The present invention may be applied to a case of adding the annotation to the content, for example.",G06K 9/00; G06N 3/00; H04N 9/87,SONY CORP,SUZUKI HIROTAKA; ITO MASATO,2010180175 11.08.2010 JP; 2011067692 02.08.2011 JP,
WO2020057145,PCT/CN2019/086426,10.05.2019,WO/2020/057145,26.03.2020,WO,"METHOD AND DEVICE FOR GENERATING PAINTING DISPLAY SEQUENCE, AND COMPUTER STORAGE MEDIUM","A method and device for generating a painting display sequence, and a computer storage medium are provided. The method for generating a painting display sequence comprises the following steps: acquiring painting data of a region of interest (ROI); clustering the painting data in a predetermined group and obtaining clustering results; and generating the painting display sequence according to the clustering result.",G06K 9/62; G06F 16/906; G06Q 30/06,"BOE TECHNOLOGY GROUP CO., LTD.","ZHOU, Xibo; LI, Hui",201811105767.5 21.09.2018 CN,
WO2020044208,PCT/IB2019/057172,27.08.2019,WO/2020/044208,05.03.2020,WO,ISA ENHANCEMENTS FOR ACCELERATED DEEP LEARNING,"Techniques in advanced deep learning provide improvements in one or more of accuracy, performance, and energy efficiency. An array of processing elements comprising a portion of a neural network accelerator performs flow-based computations on wavelets of data. Each processing element has a respective compute element and a respective routing element. Each compute element is enabled to execute instructions in accordance with an ISA. The ISA is enhanced in accordance with improvements with respect to deep learning acceleration.",G06N 3/08; G06N 3/04; G06N 3/063,CEREBRAS SYSTEMS INC.,"MORRISON, Michael; JAMES, Michael Edwin; LIE, Sean; AREKAPUDI, Srikanth; LAUTERBACH, Gary R.","62/724,333 29.08.2018 US; 62/881,214 31.07.2019 US",
WO2018110963,PCT/KR2017/014617,13.12.2017,WO/2018/110963,21.06.2018,WO,MOVABLE OBJECT AND METHOD FOR CONTROLLING THE SAME,"Embodiments of the present disclosure relate to a movable object and a method for controlling the same. A method for controlling a movable object may include acquiring virtual data representing distances between each of a plurality of positions within an area and surfaces in the area, in a plurality of directions, respectively, based on a map of the area. An algorithm, such as a machine learning algorithm, may be executed that outputs positions corresponding to the virtual data. Actual distance data between the movable object and a plurality of surfaces in the vicinity of the movable object may be acquired. An actual position of the movable object may then be estimated corresponding to the actual distance data by executing the algorithm using the actual distance data. The movable object may be controlled based on the estimated actual position.",G05D 1/02; G06N 3/08,"SAMSUNG ELECTRONICS CO., LTD.","YOON, Suk June; PARK, Soon Yong; KWAK, No San; ROH, Kyung Shik; AHN, Sung Hwan; CHOI, Min Yong",10-2016-0172299 16.12.2016 KR,EP-2017880334
WO2020005599,PCT/US2019/037408,17.06.2019,WO/2020/005599,02.01.2020,WO,TREND PREDICTION BASED ON NEURAL NETWORK,"Implementations of the present disclosure relate to trend prediction based on neural network. In some implementations, a method comprises: obtaining time series data associated with an object; computing a vector representation of the time series data with a recurrent neural network; determining, based on the vector representation of the times series data, a probability that the object is associated with a predefined label, wherein the label indicates a class of a trend in which the object varies over time; and generating, based on the probability, a prediction for the trend in which the object varies over time.",G06N 3/04; G06N 3/08; G06N 5/00,"MICROSOFT TECHNOLOGY LICENSING, LLC","LIU, Weiqing; BIAN, Jiang; LIU, Tie-Yan",201810716540.8 29.06.2018 CN,
WO2017052709,PCT/US2016/039661,27.06.2016,WO/2017/052709,30.03.2017,WO,TRANSFER LEARNING IN NEURAL NETWORKS,"A method of transfer learning includes receiving second data and generating, via a first network, second labels for the second data. In one configuration, the first network has been previously trained on first labels for first data. Additionally, the second labels are generated for training a second network.",G06N 3/04,QUALCOMM INCORPORATED,"WIERZYNSKI, Casimir Matthew","62/195,763 22.07.2015 US; 14/851,911 11.09.2015 US",EP-2016826207; JP-2018502806; KR-1020187001459
WO2019099594,PCT/US2018/061155,14.11.2018,WO/2019/099594,23.05.2019,WO,AUTOMATIC OPTIMIZATION OF MEASUREMENT ACCURACY THROUGH ADVANCED MACHINE LEARNING TECHNIQUES,"Machine learning techniques are used to predict values of fixed parameters when given reference values of critical parameters. For example, a neural network can be trained based on one or more critical parameters and a low-dimensional real-valued vector associated with a spectrum, such as a spectroscopic ellipsometry spectrum or a specular reflectance spectrum. Another neural network can map the low-dimensional real-valued vector. When using two neural networks, one neural network can be trained to map the spectra to the low-dimensional real-valued vector. Another neural network can be trained to predict the fixed parameter based on the critical parameters and the low-dimensional real-valued vector from the other neural network.",G06N 3/04; G06N 3/08,KLA-TENCOR CORPORATION,"ZHAN, Tianrong; XU, Yin; LEE, Lie-Quan Rich","62/586,660 15.11.2017 US; 15/903,693 23.02.2018 US",
WO2016004062,PCT/US2015/038589,30.06.2015,WO/2016/004062,07.01.2016,WO,FEATURE PROCESSING TRADEOFF MANAGEMENT,"At a machine learning service, a set of candidate variables that can be used to train a model is identified, including at least one processed variable produced by a feature processing transformation. A cost estimate indicative of an effect of implementing the feature processing transformation on a performance metric associated with a prediction goal of the model is determined. Based at least in part on the cost estimate, a feature processing proposal that excludes the feature processing transformation is implemented.",G06N 99/00,"AMAZON TECHNOLOGIES, INC.","DIRAC, Leo Parker; CORREA, Nicolle M.; DANNAKER, Charles Eric; INGERMAN, Aleksandr Mikhaylovich; KRISHNAN, Sriram; LI, Jin; PUVVADI, Sudhakar Rao; ZARANDIOON, Saman; RAMAKRISHNAN, Rakesh; ZHENG, Tianming; ZHUO, Donghui; AGARWAL, Tarun; STEELE, Robert Matthias; QIAN, Jun; BRUECKNER, Michael; HERBRICH, Ralf; BLICK, Daniel; LEE, Polly Po Yee","14/319,880 30.06.2014 US; 14/319,902 30.06.2014 US; 14/460,314 14.08.2014 US; 14/460,312 14.08.2014 US; 14/463,434 19.08.2014 US; 14/484,201 11.09.2014 US; 14/489,449 17.09.2014 US; 14/489,448 17.09.2014 US; 14/538,723 11.11.2014 US; 14/569,458 12.12.2014 US",JP-2016575811; CA-2953817; EP-2015739124
WO2012149550,PCT/US2012/035842,30.04.2012,WO/2012/149550,01.11.2012,WO,METHODS OF IDENTIFICATION AND DIAGNOSIS OF LUNG DISEASES USING CLASSIFICATION SYSTEMS AND KITS THEREOF,"The invention provides biomarkers and combinations of biomarkers useful in diagnosing lung diseases such as non-smail cell lung cancer or reactive airway disease. Measurements of these biomarkers are inputted into a classification system such as a support vector machine or AdaBoost to assist in determining the likelihood that an individual has a lung disease. Kits comprising agents for detecting the biomarkers and combination of biomarkers, as well as systems that assist in diagnosing lung diseases are also provided.",G01N 33/574,"CANCER PREVENTION AND CURE, LTD.; STREEPER, Robert, T.; IZBICKA, Elzbieta; MICHALEK, Joel; LOUDEN, Chris","STREEPER, Robert, T.; IZBICKA, Elzbieta; MICHALEK, Joel; LOUDEN, Chris","61/480,802 29.04.2011 US; 61/619,279 02.04.2012 US",EP-2012777309; US-13988262; EP-2017181546; JP-2014508183; IL-229070; KR-1020137031742; CA-2834383; AU-2012249288; IL-261313
EP14006083,02710486,04.02.2002,1359481,05.11.2003,EP,"AGENT LEARNING APPARATUS, METHOD, AND PROGRAM","An agent learning apparatus comprises a sensor (301) for acquiring a sense input, an action controller (307) for creating an action output in response to the sense input and giving the action output to a controlled object, an action state evaluator (303) for evaluating the behavior of the controlled object, a selective attention mechanism (304) for storing the action output and the sense input corresponding to the action output in one of the columns according to the evaluation, calculating a probability model from the action outputs stored in the columns, and outputting, as a learning result, the action output related to a newly given sense input in the column where the highest confidence obtained by applying the newly given sense input to the probability model is stored. By thus learning, the selective attention mechanism (304) obtains a probability relationship between the sense input and the column. An action output is calculated on the basis of the column evaluated as a stable column. As a result, the dispersion of the action output is quickly minimized, and thereby the controlled object can be stabilized. <IMAGE>",G05B 13/02; G06F 15/18; G06N 3/00; G06N 99/00,HONDA MOTOR CO LTD,KOSHIZEN TAKAMASA; TSUJINO HIROSHI,0200878 04.02.2002 JP; 2001028758 05.02.2001 JP; 2001028759 05.02.2001 JP,
WO2016122787,PCT/US2015/065327,11.12.2015,WO/2016/122787,04.08.2016,WO,HYPER-PARAMETER SELECTION FOR DEEP CONVOLUTIONAL NETWORKS,"Hyper-parameters are selected for training a deep convolutional network by selecting a number of network architectures as part of a database. Each of the network architectures includes one or more local logistic regression layer and is trained to generate a corresponding validation error that is stored in the database. A threshold error for identifying a good set of network architectures and a bad set of network architectures may be estimated based on validation errors in the database. The method also includes choosing a next potential hyper-parameter, corresponding to a next network architecture, based on a metric that is a function of the good set of network architectures. The method further includes selecting a network architecture, from among next network architectures, with a lowest validation error.",G06N 3/08; G06N 7/00,QUALCOMM INCORPORATED,"TALATHI, Sachin Subhash; JULIAN, David Jonathan","62/109,470 29.01.2015 US; 14/848,296 08.09.2015 US",EP-2015817719
WO2017120253,PCT/US2017/012209,04.01.2017,WO/2017/120253,13.07.2017,WO,GENERATING HIGH RESOLUTION IMAGES FROM LOW RESOLUTION IMAGES FOR SEMICONDUCTOR APPLICATIONS,Methods and systems for generating a high resolution image for a specimen from one or more low resolution images of the specimen are provided. One system includes one or more computer subsystems configured for acquiring one or more low resolution images of a specimen. The system also includes one or more components executed by the one or more computer subsystems. The one or more components include a model that includes one or more first layers configured for generating a representation of the one or more low resolution images. The model also includes one or more second layers configured for generating a high resolution image of the specimen from the representation of the one or more low resolution images.,G06T 3/40; G06N 3/08; G06N 99/00,KLA-TENCOR CORPORATION,"ZHANG, Jing; CHEN, Grace H.; BHASKAR, Kris; WELLS, Keith; BAI, Nan; GU, Ping; GAO, Lisheng","62/274,731 04.01.2016 US; 15/396,800 02.01.2017 US",IL-259822; KR-1020187022260
