Time:,20.04.2020 22:09:17,...3,...4,...5,...6,...7,...8,...9,...10,...11,...12,...13
Query:,AItechniqueMachineLearningLatentRepresentations,,,,,,,,,,,
Offices:,"EP,WO",,,,,,,,,,,
SortBy:,Relevance,,,,,,,,,,,
,,,,,,,,,,,,
Application Id,Application Number,Application Date,Publication Number,Publication Date,Country,Title,Abstract,I P C,Applicants,Inventors,Priorities Data,National Phase Entries
WO2019036127,PCT/US2018/041068,06.07.2018,WO/2019/036127,21.02.2019,WO,FRAMEWORK FOR RAPID ADDITIVE DESIGN WITH GENERATIVE TECHNIQUES,"According to some embodiments, a system may include a design experience data store containing electronic records associated with prior industrial asset item designs. A deep learning model platform, coupled to the design experience data store, may include a communication port to receive constraint and load information from a designer device. The deep learning platform may further include a computer processor adapted to automatically and generatively create boundaries and geometries, using a deep learning model associated with an additive manufacturing process, for an industrial asset item based on the prior industrial asset item designs and the received constraint and load information. According to some embodiments, the deep learning model computer processor is further to receive design adjustments from the designer device. The received design adjustments might be for example, used to execute an optimization process and/or be fed back to continually re-train the deep learning model.",G06N 3/08; B29C 64/386; B33Y 50/00,GENERAL ELECTRIC COMPANY,"SUBRAMANIYAN, Arun Karthi; BARUA, Ananda; ERNO, Daniel","15/678,653 16.08.2017 US",EP-2018846975
WO2019071384,PCT/CN2017/105377,09.10.2017,WO/2019/071384,18.04.2019,WO,"INTELLIGENT SYSTEMS AND METHODS FOR PROCESS AND ASSET HEALTH DIAGNOSIS, ANOMOLY DETECTION AND CONTROL IN WASTEWATER TREATMENT PLANTS OR DRINKING WATER PLANTS","Described herein are systems and methods of analyzing data acquired from a water plant, both historical and in real-time, making determinations about process and asset health diagnosis and anomaly detection using advanced techniques, and controlling the plant and/or providing alerts based on such determinations.",G01N 33/18; G06F 17/30,"BL TECHNOLOGIES, INC.","LU, Su; XIA, Zijun; WAN, Zhaoyang; WANG, Yu; BI, Xijing; WANG, Guoliang; TANG, Chuanyou; ZHU, Zhiping; MA, Wenchao; DONG, Qin; WANG, Sijing; LI, Yisong; LING, Jiajia",,CA-3049807; CN-201780078171.8; EP-2017928507
WO2018017467,PCT/US2017/042356,17.07.2017,WO/2018/017467,25.01.2018,WO,"DISTRIBUTED MACHINE LEARNING SYSTEMS, APPARATUS, AND METHODS","A distributed, online machine learning system is presented. Contemplated systems include many private data servers, each having local private data. Researchers can request that relevant private data servers train implementations of machine learning algorithms on their local private data without requiring de-identification of the private data or without exposing the private data to unauthorized computing systems. The private data servers also generate synthetic or proxy data according to the data distributions of the actual data. The servers then use the proxy data to train proxy models. When the proxy models are sufficiently similar to the trained actual models, the proxy data, proxy model parameters, or other learned knowledge can be transmitted to one or more non-private computing devices. The learned knowledge from many private data servers can then be aggregated into one or more trained global models without exposing private data.",G06N 99/00; G06N 5/04,"NANTOMICS, LLC; NANT HOLDINGS IP, LLC","SZETO, Christopher; BENZ, Stephen, Charles; WITCHEY, Nicholas, J.","62/363,697 18.07.2016 US",EP-2017831625; SG-11201900220R; KR-1020197004647; MX-MX/a/2019/000713; AU-2017300259; IL-264281; CA-3031067; JP-2019502045; CN-201780056525.9
WO2018035073,PCT/US2017/046844,15.08.2017,WO/2018/035073,22.02.2018,WO,DEEP LEARNING FOR CLASSIFICATION OF SWALLOWS,"A method of classifying a swallow of a subject includes obtaining vibration data that is based on and indicative of a number of vibrations resulting from the swallow, and using a computer implemented deep learning classifier to classify the swallow based on the vibration data. Also, a system for classifying a swallow of a subject includes a computing device implementing a deep learning classifier. The computing device includes a processor apparatus structured and configured to receive vibration data that is based on and indicative of a number of vibrations resulting from the swallow, and use the deep learning classifier to classify the swallow based on the vibration data. The deep learning classifier may comprise a single layer or a multi-layer Deep Belief network.",G06N 3/08; G06F 19/00,UNIVERSITY OF PITTSBURGH-OF THE COMMONWEALTH SYSTEM OF HIGHER EDUCATION,"SEJDIC, Ervin; EL-JAROUDI, Amro; COYLE, James; DUDIK, Joshua; SUN, Mingui; MAO, Zhi-Hong","62/375,964 17.08.2016 US",
WO2018205922,PCT/CN2018/085987,08.05.2018,WO/2018/205922,15.11.2018,WO,METHODS AND SYSTEMS FOR PULMONARY FUNCTION TEST BASED ON DIAGNOSTIC MEDICAL IMAGING AND MACHINE LEARNING,"Described herein are methods pertaining to perform the pulmonary function test based on diagnostic imaging and machine learning. In an implementation, a set of diagnostic thoracic images are acquired from some imaging device at one or more time phase points in a succession during respiration of a subject; left and right lung are segmented from the images and each lung is segmented into a plurality of regions of interest; the condition of each region of interest is classified into one specific category; a set of features are extracted from the images, reconstructed regions and their categories; and the pulmonary function indicators are derived using machine learning models from these features.",G06T 7/00,SUZHOU COMPLEXIS MEDICAL INC.,"ZHOU, Yin; LIU, Hui; ZHU, Taofeng; ZHU, Meng; HUI, Zhouguang",PCT/CN2017/083431 08.05.2017 CN,
WO2007053470,PCT/US2006/042089,27.10.2006,WO/2007/053470,10.05.2007,WO,DETECTING HUMANS VIA THEIR POSE,"A method and system efficiently and accurately detects humans in a test image and classifies their pose. In a training stage, a probabilistic model is derived in an unsupervised or semi- supervised manner such that at least some poses are not manually labeled. The model provides two sets of model parameters to describe the statistics of images containing humans and images of background scenes. In a testing stage, the probabilistic model is used to determine if a human is present in the image, and classify the human's pose based on the poses in the training images. A solution is efficiently provided to both human detection and pose classification by using the same probabilistic model to solve the problems.",G06K 9/00; G06K 9/62; G06K 9/46,"HONDA MOTOR CO., LTD.; YANG, Ming-Hsuan; BISSACCO, Alessandro","YANG, Ming-Hsuan; BISSACCO, Alessandro","60/731,400 28.10.2005 US; 11/553,388 26.10.2006 US",EP-6826921
WO2018162945,PCT/IB2017/051276,05.03.2017,WO/2018/162945,13.09.2018,WO,INVESTMENT ANALYSIS USING EVENT DETECTION ON ALTERNATIVE DATA,"This research project represents a very unique way of performing investment analysis. The idea is to identify different types of market, financial, geo-political, social and economic events that could help identify the reasons behind speculations that lead to stock market fluctuations. The proposed framework is broken down into 3 phases. The first phase is responsible for data extraction from e-newspapers likes the economic times and business insider using information extraction techniques of web scraping, crawling and harvesting. It then involves knowledge representation and reasoning using methods like bag-of-words and TF-IDFs to store semantic data. The second phase is responsible for event detection using Topic Modeling algorithms like Latent Semantic Analysis (LSA) & Latent Dirichlet Allocation (LDA) and Entity Extraction and Chunking methods like Name Entity Recognition (NER). It then involves correlation and causation analytics to identify trends among events and stock markets by focusing on company portfolios. The third phase is real time visualization using interactive graphs that demonstrates the effects of trending events on stock markets.",G06Q 40/06; G06F 17/30,"SANYAL, Aniket","SANYAL, Aniket",PCT/IB2017/050317 05.03.2017 IB,
WO2018120123,PCT/CN2016/113741,30.12.2016,WO/2018/120123,05.07.2018,WO,GOAL NAVIGATION,"A method, apparatus and system for navigating to a goal. A start node and a target node may be determined among a plurality of nodes. Each node is associated with at least one training sample. Each training sample is associated with at least one individual attribute. One or more weights in connection with individual attributes associated with a first node may be calculated based on training samples associated with the first node with a machine learning model. The weights may be configured to navigate the first node to a second node. Information on at least one path navigated from the start node to the target node may be provided based on the weights in connection with the individual attributes associated with at least one node placed on the path.",G06F 17/30,"MICROSOFT TECHNOLOGY LICENSING, LLC; WANG, Dong; XIA, Yunqing; LIU, Xue; YU, Hong","WANG, Dong; XIA, Yunqing; LIU, Xue; YU, Hong",,
EP45426794,11183094,28.09.2011,2434415,28.03.2012,EP,Information relation generation,"For generating a word space, manual thresholding of word scores is used. Rather than requiring the user to select the threshold arbitrarily or review each word, the user is iteratively requested to indicate the relevance of a given word. Words with greater or lesser scores are labeled in the same way depending upon the response. For determining the relationship between named entities, Latent Dirichlet Allocation (LDA) is performed on text associated with the name entities rather than on an entire document. LDA for relationship mining may include context information and/or supervised learning.",G06F 17/30; G06F 17/27,SIEMENS CORP,LI DINGCHENG; SOMASUNDARAN SWAPNA; CHAKRABORTY AMIT,201113214291 22.08.2011 US; 38716510 28.09.2010 US; 38801710 30.09.2010 US,
WO2014204970,PCT/US2014/042754,17.06.2014,WO/2014/204970,24.12.2014,WO,DATA INTELLIGENCE USING MACHINE LEARNING,"Apparatuses, systems, methods, and computer program products are presented for performing data analytics using machine learning 222. An unsupervised learning module 208 is configured to assemble an unstructured data set into multiple versions of an organized data set. A supervised learning module 206 is configured to generate one or more machine learning ensembles 222 based on each version of multiple versions of an organized data set and to determine which machine learning ensemble 222 exhibits a highest predictive performance.",G06F 17/27; G06N 5/02,"PUREPREDICTIVE, INC.","PHILLIPPS, Kelly D.; WELLMAN, Richard W.; RAHMAN, Sardar Monzurur; PHILLIPS, Matthew B.","61/836,135 17.06.2013 US; 14/266,119 30.04.2014 US",
WO2015066564,PCT/US2014/063594,31.10.2014,WO/2015/066564,07.05.2015,WO,METHODS OF IDENTIFICATION AND DIAGNOSIS OF LUNG DISEASES USING CLASSIFICATION SYSTEMS AND KITS THEREOF,"The invention provides biomarkers and combinations of biomarkers useful in diagnosing lung diseases such as non-small cell lung cancer or reactive airway disease. Measurements of these biomarkers are inputted into a classification system such as a support vector machine or AdaBoost to assist in determining the likelihood that an individual has a lung disease. Kits comprising agents for detecting the biomarkers and combination of biomarkers, as well as systems that assist in diagnosing lung diseases are also provided.",G01N 33/48; C40B 30/04,"CANCER PREVENTION AND CURE, LTD.; SZUSTKIEWICZ, Christopher, P.; GOEBEL, Cherylle","SZUSTKIEWICZ, Christopher, P.; GOEBEL, Cherylle; LONG, Thomas, C.; LOUDEN, Chris; MICHALEK, Joel","61/898,306 31.10.2013 US",
EP235753960,15305829,29.05.2015,3098728,30.11.2016,EP,METHOD AND APPARATUS FOR CREATING RECOMMENDATION LISTS OF MEDIA ASSETS,A recommendation system uses text reviews of media assets to generate lists of those media assets most similar to a first media asset. The system concatenates text reviews of the same media assets into distinct documents and weights the words of the document according to the number of reviews in the document. A latent Dirichlet allocation is used to extract profiles from the aggregated documents which are then used to generate a similarity measure relative to the first media asset.,G06F 17/30,THOMSON LICENSING; INST NAT RECH INF AUTOMAT,DUPUY CHRISTOPHE; DIOT CHRISTOPHE; BACH FRANCIS,15305829 29.05.2015 EP,
EP235753961,15305831,29.05.2015,3098729,30.11.2016,EP,METHOD AND DEVICE FOR CREATING RECOMMENDATION LISTS OF MEDIA ASSETS,"A recommendation system uses text reviews of media assets to generate lists of those media assets most similar to a combination of genres shared with a first media asset. The system concatenates text reviews of the same media assets into separate documents. A latent Dirichlet allocation is used to extract profiles from the aggregated documents which are then used to generate a similarity measure relative to the first media asset, based on common profile characteristics. In one embodiment, the profile characteristic is genre of the media assets.",G06F 17/30,THOMSON LICENSING,DUPUY CHRISTOPHE; DIOT CHRISTOPHE,15305831 29.05.2015 EP,
WO2019051359,PCT/US2018/050177,10.09.2018,WO/2019/051359,14.03.2019,WO,A SYSTEM AND METHOD FOR AUTOMATED LABELING AND ANNOTATING UNSTRUCTURED MEDICAL DATASETS,"Supervised and unsupervised learning schemes may be used to automatically label medical images for use in deep learning applications. Large labeled datasets may be generated from a small initial training set using an iterative snowball sampling scheme. A machine learning powered automatic organ classifier for imaging datasets, such as CT datasets, with a deep convolutional neural network (CNN) followed by an organ dose calculation is also provided. This technique can be used for patient-specific organ dose estimation since the locations and sizes of organs for each patient can be calculated independently.",G06F 15/18,THE GENERAL HOSPITAL CORPORATION,"DO, Synho","62/555,799 08.09.2017 US; 62/555,767 08.09.2017 US",
WO2003044687,PCT/US2002/036533,15.11.2002,WO/2003/044687,30.05.2003,WO,PAUSIBLE NEURAL NETWORK WITH SUPERVISED AND UNSUPERVISED CLUSTER ANALYSIS,"A plausible neural network (PLANN) is an artificial neural network with weight connection given by mutual information, which has the capability and learning, and yet retains many characteristics of a biological neural network. The learning algorithm (300, 301, 302, 304, 306, 308) is based on statistical estimation, which is faster than the gradient decent approach currently used. The network after training becomes a fuzzy/belief network; the inference and weight are exchangeable, and as a result, knowledge extraction becomes simple. PLANN performs associative memory, supervised, semi-supervised, unsupervised learning and function/relation approximation in a single network architecture. This network architecture can easily be implemented by analog VLSI circuit design.",G06N 3/04,"CHEN, Yuan Yan; CHEN, Joseph","CHEN, Yuan Yan; CHEN, Joseph","60/331,476 16.11.2001 US",MX-PA/a/2004/004542; AU-2002356946; JP-2003546255; CA-2467401; CN-02825108.3; EP-2002803620
WO2018200272,PCT/US2018/028057,18.04.2018,WO/2018/200272,01.11.2018,WO,DATA SOVEREIGNTY COMPLIANT MACHINE LEARNING,"The subject disclosure relates to systems for managing the deployment and updating of incremental machine learning models across multiple geographic sovereignties. In some aspects, systems of the subject technology are configured to perform operations including: receiving a first machine learning model via a first coordination agent, the first machine learning model based on a first training data set corresponding with a first sovereign region, sending the first machine learning model to a second coordination agent in a second sovereign region, wherein the second sovereign region is different from the first sovereign region, and receiving a second machine learning model from the second coordination agent, wherein the second machine learning model is based on updates to the first machine learning model using a second training data set corresponding with the second sovereign region. Methods and machine-readable media are also provided.",G06F 9/50; G06N 99/00,"CISCO TECHNOLOGY, INC.","CHEN, Eric","15/582,089 28.04.2017 US",EP-2018725053
WO2012036934,PCT/US2011/050472,06.09.2011,WO/2012/036934,22.03.2012,WO,DEEP BELIEF NETWORK FOR LARGE VOCABULARY CONTINUOUS SPEECH RECOGNITION,"A method is disclosed herein that includes an act of causing a processor to receive a sample, wherein the sample is one of spoken utterance, an online handwriting sample, or a moving image sample. The method also comprises the act of causing the processor to decode the sample based at least in part upon an output of a combination of a deep structure and a context-dependent Hidden Markov Model (HMM), wherein the deep structure is configured to output a posterior probability of a context-dependent unit. The deep structure is a Deep Belief Network consisting of many layers of nonlinear units with connecting weights between layers trained by a pretraining step followed by a fine-tuning step.",G10L 15/14; G10L 15/16,MICROSOFT CORPORATION,"DENG, Li; YU, Dong; DAHL, George Edward","12/882,233 15.09.2010 US",EP-2011825687
WO2020037244,PCT/US2019/046884,16.08.2019,WO/2020/037244,20.02.2020,WO,USE OF MACHINE LEARNING MODELS FOR PREDICTION OF CLINICAL OUTCOMES,"The present disclosure describes methods and systems for predicting if a subject has an increased risk of having or developing one or more clinical outcomes, including prior to the detection of symptoms thereof and/or prior to onset of any detectable symptoms thereof. The present disclosure also describes a method of generating a model for predicting one or more clinical outcomes.",G06E 1/00,HENRY M. JACKSON FOUNDATION FOR THE ADVANCEMENT OF MILITARY MEDICINE; NAVAL MEDICAL RESEARCH CENTER; DUKE UNIVERSITY MEDICAL CENTER; EMORY UNIVERSITY,"SCHOBEL, Seth A.; KHATRI, Vivek; LISBOA, Felipe; BRADLEY, Matthew J.; DENTE, Christopher J.; BUCHMAN, Timothy; KIRK, Allan D.; FORSBERG, Jonathan A.; BRENNAN, Todd V.; ELSTER, Eric A.","62/764,963 17.08.2018 US",
WO2019018693,PCT/US2018/042964,19.07.2018,WO/2019/018693,24.01.2019,WO,METHODS OF ANALYZING MICROSCOPY IMAGES USING MACHINE LEARNING,Disclosed herein are methods of utilizing machine learning methods to analyze microscope images of populations of cells.,G06T 7/00; G06F 19/18,ALTIUS INSTITUTE FOR BIOMEDICAL SCIENCES,"STAMATOYANNOPOULOS, John A.; AKILESH, Shreeram; MURATOV, Alexander; MEULEMAN, Wouter; KERWIN, William","62/534,679 19.07.2017 US",
WO2019051426,PCT/US2018/050290,10.09.2018,WO/2019/051426,14.03.2019,WO,PRUNING ENGINE,"A method and apparatus are disclosed for enhancing operable functionality of input source code files from a software program by preprocessing input source code files with codeword processing operations to generate a plurality of preprocessed input source code files, identifying candidate code snippets by pruning one or more preprocessed input source code files that do not meet a similarity threshold measure for library functions stored in the system library, and identifying at least a first validated code snippet from the one or more candidate code snippets that matches a first library function stored in the system memory on the basis of at least first and second matching metrics.",G06F 8/36; G06F 8/77; G06F 8/75; G06F 17/30; G06F 8/72,"VERSATA DEVELOPMENT GROUP, INC.","MAKKAR, Tushar","15/699,510 08.09.2017 US",
WO2018085697,PCT/US2017/060003,03.11.2017,WO/2018/085697,11.05.2018,WO,TRAINING NEURAL NETWORKS USING A VARIATIONAL INFORMATION BOTTLENECK,"Methods, systems, and apparatus, including computer programs encoded on computer storage media, for training a neural network. One of the methods includes receiving training data; training a neural network on the training data, wherein the neural network is configured to: receive a network input, convert the network input into a latent representation of the network input, and process the latent representation to generate a network output from the network input, and wherein training the neural network on the training data comprises training the neural network on a variational information bottleneck objective that encourages, for each training input, the latent representation generated for the training input to have low mutual information with the training input while the network output generated for the training input has high mutual information with the target output for the training input.",G06N 3/08; G06N 3/04,GOOGLE LLC,"ALEMI, Alexander, Amir","62/418,100 04.11.2016 US",EP-2017800680; CN-201780066234.8
WO2017176356,PCT/US2017/016715,06.02.2017,WO/2017/176356,12.10.2017,WO,PARTITIONED MACHINE LEARNING ARCHITECTURE,"A system may include a processor and a memory. The memory may include program code that provides operations when executed by the processor. The operations may include: partitioning, based at least on a resource constraint of a platform, a global machine learning model into a plurality of local machine learning models; transforming training data to at least conform to the resource constraint of the platform; and training the global machine learning model by at least processing, at the platform, the transformed training data with a first of the plurality of local machine learning models.",G06N 99/00; G06N 3/08,WILLIAM MARSH RICE UNIVERSITY,"ROUHANI, Bita Darvish; MIRHOSEINI, Azalia; KOUSHANFAR, Farinaz","62/294,215 11.02.2016 US",
EP206658720,16172126,31.05.2016,3252671,06.12.2017,EP,METHOD OF TRAINING A DEEP NEURAL NETWORK,"The invention describes a method of training a deep neural network (N) to perform a specific image processing task, which method comprises the steps of extracting a plurality of pseudo-targets (101 PS , ..., 105 PS ) from a non-annotated set (DB na ) of medical images; performing supervised pre-training on an initialized network (N init ) to obtain a pre-trained network (N pre ) with a pseudo-task specific top layer (L PTS ) ; replacing the pseudo-task specific layer (L PTS ) by a task-specific layer (L TS ); and performing supervised training on the pre-trained network (N pre ) using an annotated set (DB) of medical images.",G06K 9/46; G06K 9/62,SIEMENS HEALTHCARE GMBH,KELM MICHAEL; PAULY OLIVIER; JEREBKO ANNA,16172126 31.05.2016 EP,
EP210427885,15885058,31.03.2015,3270329,17.01.2018,EP,BIG DATA PROCESSING METHOD FOR SEGMENT-BASED TWO-GRADE DEEP LEARNING MODEL,"Provided is a big data processing method for a segment-based two-grade deep learning model. The method comprises: step 1), constructing and training a segment-based two-grade deep learning model, wherein the model is divided into two grades in a longitudinal level: a first grade and a second grade, each layer of the first grade is divided into M segments in a horizontal direction, and the weight between neuron nodes of adjacent layers in different segments of the first grade is zero; step 2), dividing big data to be processed into M sub-sets according to the type of the data and respectively inputting same into M segments of a first layer of the segment-based two-grade deep learning model for processing; and step 3), outputting a big data processing result. The segment-based two-grade deep learning model provided in the present invention can effectively reduce the scale of a model and shortens a training time of the model. The method of the present invention can increase the big data processing speed and shorten the processing time.",G06N 3/02; G06N 3/04; G06N 3/08,INST ACOUSTICS CAS; SHANGHAI 3NTV NETWORK TECH CO LTD,WANG JINLIN; YOU JIALI; SHENG YIQIANG; LI CHAOPENG,2015075472 31.03.2015 CN; 201510111904 13.03.2015 CN,
WO2017207138,PCT/EP2017/058100,05.04.2017,WO/2017/207138,07.12.2017,WO,METHOD OF TRAINING A DEEP NEURAL NETWORK,"The invention describes a method of training a deep neural network (N) to perform a specific image processing task, which method comprises the steps of extracting a plurality of pseudo-targets (101PS,..., 105PS) from a non-annotated set (DBna) of medical images; performing supervised pre-training on an initialized network (Ninit) to obtain a pre-trained network (Npre) with a pseudo-task specific top layer (LPTS); replacing the pseudo-task specific layer (LPTS) by a task- specific layer (LTS); and performing supervised training on the pre-trained network (Npre) using an annotated set (DB) of medical images.",G06K 9/46; G06K 9/62,SIEMENS HEALTHCARE GMBH,"KELM, Michael; PAULY, Olivier; JEREBKO, Anna",16172126.1 31.05.2016 EP,
