WO2020035514,PCT/EP2019/071769,14.08.2019,WO/2020/035514,20.02.2020,WO,GENERATING ANNOTATION DATA OF TISSUE IMAGES,"Currently, there is interest in applying machine learning techniques to analyse digital pathology images automatically. Machine learning techniques often rely on training with a ground-truth image input. The quality and amount of training data determines the quality of the detector, as expressed in the rate of true and false positives, and robustness against variations in the appearance of the input images. The present application proposes to obtain image data of the same sample before and after at least one re- staining step (firstly with a structure-revealing stain, and secondly with a bio marker revealing stain). Sections of the first and second image data having a good registration relationship are chosen, along with the probability of detecting a desired candidate object (such as nucleus) and the probability of the bio marker revealing stain being present annotation data suitable for training a machine learning algorithm on the first and/or the second image data is provided.",G06T 7/00,KONINKLIJKE PHILIPS N.V.,"ZUO, Fei; PIERIK, Anke; WIMBERGER-FRIEDL, Reinhold; DE LAAT, Koen; VAN DRIEL, Marc",18189097.1 15.08.2018 EP,
WO2015054240,PCT/US2014/059480,07.10.2014,WO/2015/054240,16.04.2015,WO,"COMPUTER IMPLEMENTED METHOD, COMPUTER SYSTEM AND SOFTWARE FOR REDUCING ERRORS ASSOCIATED WITH A SITUATED INTERACTION","A computer implemented method and computer system for reducing errors associated with a situated interaction performed by at least two agents of a sociotechnical team and for augmenting situation awareness of the at least two agents. Also, a non-transitory computer- readable storage medium used to store instructions relating to the computer method and the computer system. The situated interaction can be surgery and the at least two agents can be members of a surgical team.",G06F 17/28,"PRESIDENT AND FELLOWS OF HARVARD COLLEGE; VETERANS AFFAIRS, THE UNITED STATES GOVERNMENT AS REPRESENTED BY THE DEPARTMENT OF","ZENATI, Marco; MARON, Jason","61/887,559 07.10.2013 US",EP-2014852109
WO2020040599,PCT/KR2019/010773,23.08.2019,WO/2020/040599,27.02.2020,WO,ELECTRONIC DEVICE AND OPERATING METHOD THEREOF OF PROCESSING NEURAL NETWORK MODEL BY USING PLURALITY OF PROCESSORS,"A method of processing a neural network model by using a plurality of processors includes allocating at least one slice to each layer from among a plurality of layers included in the neural network model, allocating each layer from among the plurality of layers to the plurality of processors based on respective processing times of the plurality of processors for processing each of the at least one slice, and processing the neural network model by using the plurality of processors based on a result of the allocation.",G06N 3/08; G06N 3/04,"SAMSUNG ELECTRONICS CO., LTD.","SAHNI, Manas; ABRAHAM, Arun; ALLUR, Sharan Kumar; MALA, Venkappa",201841031660 23.08.2018 IN; 201841031660 20.08.2019 IN,
WO2020023454,PCT/US2019/042945,23.07.2019,WO/2020/023454,30.01.2020,WO,PHISHING DETECTION ENHANCED THROUGH MACHINE LEARNING TECHNIQUES,Phishing enhancement and phishing detection enhancement technologies. The technologies can include determinations of an effectiveness rate of one or more phishing threat actors. The technologies can also include selection of effective URLs from at least one effective phishing threat actor. The technologies can also include generation or adjustment of a phishing system using a machine learning process to identify patterns in the selected effective URLs that enable the selected effective URLs to avoid detection by the phishing detection system. The technologies can also include generation of synthetic phishing URLs using the phishing system and the identified patterns. The technologies can also include adjustments or training of the phishing system or the phishing detection system according to the synthetic phishing URLs to enhance the systems.,H04L 29/06; G06N 20/00; G06N 3/08,EASY SOLUTIONS ENTERPRISES CORP.,"CORREA BAHNSEN, Alejandro; TORROLEDO PENA, Ivan Dario; CAMACHO GONZALEZ, Luis David; VILLEGAS PIEDRAHITA, Sergio","16/045,527 25.07.2018 US",
WO2003040949,PCT/US2002/035576,07.11.2002,WO/2003/040949,15.05.2003,WO,Pre-processed Feature Ranking for a support Vector Machine,Features are preprocessed (204) to minimize classification error in a Support Vector Machines (200) used to identify patterns in large databases. Pre-processing (204) is performed to constrain features used to train (210) the SVM learning machine. Live data (226) is collected and processed (232) with SVM.,G06F 15/18; G06K 9/62,"BIOWULF TECHNOLOGIES, LLC; WESTON, Jason; ELLISSEEF, Andre; SCHLKOPF, Bernhard; PEREZ-CRUZ, Fernando; GUYON, Isabelle","WESTON, Jason; ELLISSEEF, Andre; SCHLKOPF, Bernhard; PEREZ-CRUZ, Fernando; GUYON, Isabelle","60/347,562 07.11.2001 US",JP-null; US-10494876; EP-2002778747
WO2018217829,PCT/US2018/033987,22.05.2018,WO/2018/217829,29.11.2018,WO,METHODS AND APPARATUS FOR ENHANCING A NEURAL NETWORK USING BINARY TENSOR AND SCALE FACTOR PAIRS,"Methods and apparatus are disclosed for enhancing a neural network using binary tensor and scale factor pairs. For one example, a method of optimizing a trained convolutional neural network (CNN) includes initializing an approximation residue as a trained weight tensor for the trained CNN. A plurality of binary tensors and scale factor pairs are determined. The approximation residue is updated using the binary tensors and scale factor pairs.",G06N 3/04; G06N 3/08,INTEL CORPORATION,"GUO, Yiwen; YAO, Anbang; ZHAO, Hao; LU, Ming; CHEN, Yurong","62/510,025 23.05.2017 US",CN-201880026768.2; EP-2018805760
WO2018184204,PCT/CN2017/079719,07.04.2017,WO/2018/184204,11.10.2018,WO,METHODS AND SYSTEMS FOR BUDGETED AND SIMPLIFIED TRAINING OF DEEP NEURAL NETWORKS,"Methods and systems for budgeted and simplified training of deep neural networks (DNNs) are disclosed. In one example a trainer is to train a DNN using a plurality of training sub-images derived from a down-sampled training image. A tester is to test the trained DNN using a plurality of testing sub-images derived from a down-sampled testing image. In another example in a recurrent deep Q-network (RDQN) having a local attention mechanism located between a convolutional neural network (CNN) and a long-short time memory (LSTM), a plurality of feature maps are generated by the CNN from an input image. Hard-attention is applied by the local attention mechanism to the generated plurality of feature maps by selecting a subset of the generated feature maps. Soft attention is applied by the local attention mechanism to the selected subset of generated feature maps by providing weights to the selected subset of generated feature maps in obtaining weighted feature maps. The weighted feature maps are stored in the LSTM. A Q value is calculated for different actions based on the weighted feature maps stored in the LSTM.",G06K 9/66; G06N 3/08,"INTEL CORPORATION; GUO, Yiwen; HOU, Yuqing; YAO, Anbang; CAI, Dongqi; WANG, Libin; XU, Lin; HU, Ping; WANG, Shandong; CHENG, Wenhua; CHEN, Yurong","GUO, Yiwen; HOU, Yuqing; YAO, Anbang; CAI, Dongqi; WANG, Libin; XU, Lin; HU, Ping; WANG, Shandong; CHENG, Wenhua; CHEN, Yurong",,CN-201780088119.0; EP-2017904518
EP14829948,07013135,29.01.2003,1850271,31.10.2007,EP,Method for video mode classification,"A method for video content classification is proposed, wherein said video comprises a sequence of images (I), each of said images (I) consisting of respective image data (ID), said method comprising: 
generating a feature vector (FV) based on said image data (ID), wherein said feature vector is descriptive of temporal and/or spatial features of at least one of said images (I); 
generating image content classification/identification data (ICCI) based on said feature vector (FV) and based on a trainable classification method; and 
classifying said video content based on said image content classification/identification data (ICCI).",G06K 9/66; G06T 5/00; H04N 5/14; H04N 5/253; H04N 7/01,SONY DEUTSCHLAND GMBH,UNRUH CHRISTIAN,03001861 29.01.2003 EP,
WO2019066841,PCT/US2017/053912,28.09.2017,WO/2019/066841,04.04.2019,WO,MULTIMODAL SENSING IN AUTONOMOUS DRIVING VEHICLES WITH SELF-HEALING CAPABILITIES,"An apparatus for autonomous vehicles includes a perception pipeline having independent classification processes operating in parallel to respectively identify objects belonging to a specific object type based on sensor data flows from multiple ones of a plurality of different types of sensors. The apparatus also includes a sensor monitoring stage to operate in parallel with the perception pipeline and to use the sensor data flows to estimate and track a confidence level of each of the plurality of different types of sensors, and nullify a deficient sensor when the confidence level associated with the deficient sensor fails to meet a confidence threshold.",G05D 1/00; G05D 1/02; G05B 23/02,INTEL CORPORATION,"ARDITTI ILITZKY, David; ALVAREZ, Ignacio J.; ZAMORA ESQUIVEL, Julio C.; LOPEZ MEYER, Paulo",,
WO2014194002,PCT/US2014/039861,28.05.2014,WO/2014/194002,04.12.2014,WO,MACHINE LEARNING GENERATED ACTION PLAN,"Apparatuses, systems, methods, and computer program products are disclosed for a machine learning 222 generated action plan. A machine learning module 202 is configured to process different instances 126 of data using machine learning 222 to produce one or more results. The different instances 126 of data may comprise different values for one or more actionable features 128, 130, 132, 134, 136, 138. A recommended action module 204 is configured to select one or more recommended actions 128, 142 for achieving a goal 150 associated with the machine learning 222. The recommended action module 204 may select the one or more recommended actions 128, 142 based on the one or more results. An action plan interface module 206 is configured to provide an action plan associated with the one or more recommended actions 128, 142.",G06F 15/18,"PUREPREDICTIVE, INC.","PHILLIPPS, Kelly D.; WELLMAN, Richard W.","13/904,963 29.05.2013 US; 14/162,571 23.01.2014 US",EP-2014803583
WO2014029764,PCT/EP2013/067297,20.08.2013,WO/2014/029764,27.02.2014,WO,METHOD FOR DETECTION OF AN ABNORMAL SLEEP PATTERN IN A PERSON,"The present disclosure relates to a method for detection of an abnormal sleep pattern based on a dataset of Electrooculography (EOG) signals obtained from a sleeping subject over a time interval, the method comprising the steps of dividing the time interval into a plurality of subintervals, each subinterval preferably corresponding to a sleep epoch, classifying each subinterval in terms of sleep stages, thereby obtaining a temporal sleep stage pattern, wherein a subject having an uncharacteristic temporal distribution of sleep stages is characterized as having an abnormal sleep pattern.",A61B 5/0496; A61B 5/00,DANMARKS TEKNISKE UNIVERSITET,"SRENSEN, Helge Bjarup Dissing; CHRISTENSEN, Julie Anja Engelhard; JENNUM, Poul Jrgen; CHRISTENSEN, Sren Rahn; ARVASTSON, Lars",12181048.5 20.08.2012 EP; 13174352.8 28.06.2013 EP,US-14422833; EP-2013755998
EP238739212,16899762,27.04.2016,3451240,06.03.2019,EP,APPARATUS AND METHOD FOR PERFORMING AUTO-LEARNING OPERATION OF ARTIFICIAL NEURAL NETWORK,"The present disclosure provides a device and a method for performing self-learning operations of an artificial neural network. The device includes an instruction storage unit, a controller unit, a data access unit, an interconnection module, a main operation module, and a number of slave operation modules. The present disclosure can perform self-learning pre-training of a multi-layer neural network according to a training mode of layer-by-layer training. For each layer of the network, the self-learning pre-training of the layer of the network is completed when the present disclosure performs many times of operational iterations until the weight is updated to be less than a certain threshold value. Each iteration process can be divided into four stages. Calculation is carried out in the first three stages to respectively generate a first-order hidden layer intermediate value, a first-order visible layer intermediate value and a second-order hidden layer intermediate value. The weight is updated in the last stage with the intermediate values of the first three stages.",G06N 3/08; G06N 3/04; G06N 3/063,CAMBRICON TECH CORPORATION LIMITED,LI ZHEN; GUO QI; CHEN YUNJI; CHEN TIANSHI,2016080320 27.04.2016 CN,
WO2019224347,PCT/EP2019/063439,24.05.2019,WO/2019/224347,28.11.2019,WO,"TRAINING A MACHINE LEARNING ALGORITHM AND PREDICTING A VALUE FOR A WEATHER DATA VARIABLE, ESPECIALLY AT A FIELD OR SUB-FIELD LEVEL","The invention relates to training a machine learning algorithm and predicting a value for a weather data variable, preferably at a field or sub-field level. In this respect, according to the invention, a method for predicting a value for at least one weather data variable for at least one instant of time in the future, is provided, the method comprising the following method steps: feeding a machine learning algorithm with a predicted weather dataset that comprises at least one predicted value for the said at least one weather data variable for the said at least one instant of time in the future and for at least one grid point of a first grid covering at least a part of the Earth's surface, feeding the machine learning algorithm with an observed environmental dataset that cornprises at least one ground truth value for at least one environmental data variable for at least one grid point of a second grid covering at least the said part of the Earth's surface, and outputting by the machine learning algorithm a predicted value for the said at least one weather data variable for the said at least one instant of time in the future. In this way, a possibility for field specific weather predictions for providing field zone specific treatment recommendations at a small-meshed grid level may be provided.",G01W 1/10; G06N 99/00,BASF AGRO TRADEMARKS GMBH,"HILL, Eva; HOFFMANN, Holger; SHANKAR, Priyamvada; PETERS, Ole; WAHABZADA, Mirwaes; KERKHOFF, Christian",18174325.3 25.05.2018 EP,
EP232545775,18159837,02.03.2018,3396602,31.10.2018,EP,NEURAL NETWORK TRAINING MECHANISM,An apparatus to facilitate neural network (NN) training is disclosed. The apparatus includes training logic to receive one or more network constraints and train the NN by automatically determining a best network layout and parameters based on the network constraints.,G06N 3/063; G06F 9/30; G06F 9/38,INTEL CORP,CILINGIR GOKCEN; OULD-AHMED-VALL ELMOUSTAPHA; BARIK RAJKISHORE; NEALIS KEVIN; CHEN XIAOMING; GOTTSCHLICH JUSTIN E; SURTI PRASOONKUMAR; SAKTHIVEL CHANDRASEKARAN; APPU ABHISHEK R; WEAST JOHN C; BAGHSORKHI SARA S; DAS BARNAN; BISWAL NARAYAN; BARAN STANLEY J; SHAH NILESH; SHARMA ARCHIE; VARERKAR MAYURESH M,201715494826 24.04.2017 US,
WO2018193370,PCT/IB2018/052651,17.04.2018,WO/2018/193370,25.10.2018,WO,TASK ACTIVATING FOR ACCELERATED DEEP LEARNING,"Techniques in advanced deep learning provide improvements in one or more of accuracy, performance, and energy efficiency. An array of processing elements performs flow-based computations on wavelets of data. Each processing element has a compute element and a routing element. Each router enables communication via wavelets with at least nearest neighbors in a 2D mesh. Routing is controlled by virtual channel specifiers in each wavelet and routing configuration information in each router. Execution of an activate instruction or completion of a fabric vector operation activates one of the virtual channels. A virtual channel is selected from a pool comprising previously activated virtual channels and virtual channels associated with previously received wavelets. A task corresponding to the selected virtual channel is activated by executing instructions corresponding to the selected virtual channel.",G06N 3/08; G06N 3/04,CEREBRAS SYSTEMS INC.,"LIE, Sean; MORRISON, Michael; AREKAPUDI, Srikanth; JAMES, Michael Edwin; LAUTERBACH, Gary R.","62/486,372 17.04.2017 US; 62/517,949 11.06.2017 US; 62/520,433 15.06.2017 US; 62/522,065 19.06.2017 US; 62/522,081 19.06.2017 US; 62/542,645 08.08.2017 US; 62/542,657 08.08.2017 US; 62/580,207 01.11.2017 US; 62/628,773 09.02.2018 US; 62/628,784 09.02.2018 US; 62/652,933 05.04.2018 US; 62/655,210 09.04.2018 US; 62/655,826 11.04.2018 US",CA-3060356; EP-2018788046; JP-2019556705
WO2016195931,PCT/US2016/031696,11.05.2016,WO/2016/195931,08.12.2016,WO,AUTOMATED EFFICIENT TRANSLATION CONTEXT DELIVERY,"Embodiments relate to automatically providing textual context for source strings in a source language that are to be translated by a human translator to target strings in a target language. The source strings are compared against a dictionary of reference strings in the source language. For each source string, one or more of the reference strings that are most relevant, similar, etc., are selected. When a human translator is to translate the source strings, the selected reference strings are presented; each source string has one or more similar/related strings displayable in association therewith. For a given source string, the human translator can use the associated reference strings as a form of context to help estimate the intended meaning of the given source string when translating the given source string to a target string in the target language.",G06F 17/28; G06F 9/44,"MICROSOFT TECHNOLOGY LICENSING, LLC","JOO, Dong Kwon","14/725,867 29.05.2015 US",
EP14169494,03001861,29.01.2003,1443453,04.08.2004,EP,Method for picture improvement,"A method for picture improvement is proposed, comprising the steps of receiving (S1) said image data (ID) as input data (I), classifying and/or identifying (S2) the content of said image data (ID), thereby generating image content classification/identification data (ICCI) from said image data (ID), improving and/or processing (S3) said image data (ID) using said image content classification/identification data (ICCI), thereby generating and/or outputting (S4) improved image data (IID) as output data (O). <IMAGE>",G06K 9/66; G06T 5/00; H04N 5/14; H04N 5/253; H04N 7/01,SONY DEUTSCHLAND GMBH,UNRUH CHRISTIAN,03001861 29.01.2003 EP,
WO2012072445,PCT/EP2011/070631,22.11.2011,WO/2012/072445,07.06.2012,WO,METHOD AND APPARATUS OF COMMUNICATIONS,"A method of controlling a telecommunications network, the network comprising at least one device arranged for interaction as regards network configuration parameters is disclosed. Examples of learning systems and network optimization during run-time are provided facilitating adaptation to a system state.",H04W 24/02; H04L 12/24,"HUAWEI TECHNOLOGIES CO., LTD.; KOUDOURIDIS, George","KOUDOURIDIS, George",PCT/SE2010/000285 03.12.2010 SE; PCT/SE2010/000287 06.12.2010 SE,EP-2011794062
WO2018194611,PCT/US2017/028575,20.04.2017,WO/2018/194611,25.10.2018,WO,RECOMMENDING A PHOTOGRAPHIC FILTER,"A system for recommending a photographic filter is described. The system includes an inference manager which extracts a feature vector from an input image, searches a database for a stored feature vector that is within a predetermined mathematical window of the feature vector in the database, identifies a photographic filter associated with the stored feature vector, and recommends the photographic filter.",G06T 1/00; G03B 11/00; G06F 15/18,"HEWLETT-PACKARD DEVELOPMENT COMPANY, L.P.","PERONE, Christian S.",,
WO2020044152,PCT/IB2019/056825,11.08.2019,WO/2020/044152,05.03.2020,WO,SCALED COMPUTE FABRIC FOR ACCELERATED DEEP LEARNING,"Techniques in advanced deep learning provide improvements in one or more of accuracy, performance, energy efficiency, and cost. In a first embodiment, a scaled array of processing elements is implementable with varying dimensions of the processing elements to enable varying price/performance systems. In a second embodiment, an array of clusters communicates via high- speed serial channels. The array and the channels are implemented on a Printed Circuit Board (PCB). Each cluster comprises respective processing and memory elements. Each cluster is implemented via a plurality of 3D-stacked dice, 2.5D-stacked dice, or both in a Ball Grid Array (BGA). A processing portion of the cluster is implemented via one or more Processing Element (PE) dice of the stacked dice. A memory portion of the cluster is implemented via one or more High Bandwidth Memory (HBM) dice of the stacked dice.",G06N 3/063; G06N 3/08,CEREBRAS SYSTEMS INC.,"LAUTERBACH, Gary R.; LIE, Sean; MORRISON, Michael; JAMES, Michael Edwin; AREKAPUDI, Srikanth","62/723,636 28.08.2018 US",
WO2019212689,PCT/US2019/025894,04.04.2019,WO/2019/212689,07.11.2019,WO,SCALABLE NEURAL NETWORK PROCESSING ENGINE,"Embodiments relate to a neural processor circuit with scalable architecture for instantiating one or more neural networks. The neural processor circuit includes a data buffer coupled to a memory external to the neural processor circuit, and a plurality of neural engine circuits. To execute tasks that instantiate the neural networks, each neural engine circuit generates output data using input data and kernel coefficients. A neural processor circuit may include multiple neural engine circuits that are selectively activated or deactivated according to configuration data of the tasks. Furthermore, an electronic device may include multiple neural processor circuits that are selectively activated or deactivated to execute the tasks.",G06N 3/04; G06N 3/063,APPLE INC.,"NORDEN, Erik; FISHEL, Liran; PARK, Sung, Hee; SHIN, Jaewon; MILLS, Christopher; LEE, Seungjin; MUJICA, Fernando","15/971,882 04.05.2018 US",
WO2017122785,PCT/JP2017/001034,13.01.2017,WO/2017/122785,20.07.2017,WO,SYSTEMS AND METHODS FOR MULTIMODAL GENERATIVE MACHINE LEARNING,"In various embodiments, the systems and methods described herein relate to multimodal generative models. The generative models may be trained using machine learning approaches, using training sets comprising chemical compounds and one or more of biological, chemical, genetic, visual, or clinical information of various data modalities that relate to the chemical compounds. Deep learning architectures may be used. In various embodiments, the generative models are used to generate chemical compounds that satisfy multiple desired characteristics of different categories.",G06N 3/04,"PREFERRED NETWORKS, INC.",OONO Kenta; CLAYTON Justin,"62/279,563 15.01.2016 US",US-16070276; JP-2018536524
WO2018148574,PCT/US2018/017666,09.02.2018,WO/2018/148574,16.08.2018,WO,AGENT NAVIGATION USING VISUAL INPUTS,"Methods, systems, and apparatus, including computer programs encoded on computer storage media, for navigation using visual inputs. One of the systems includes a mapping subsystem configured to, at each time step of a plurality of time steps, generate a characterization of an environment from an image of the environment at the time step, wherein the characterization comprises an environment map identifying locations in the environment having a particular characteristic, and wherein generating the characterization comprises, for each time step: obtaining the image of the environment at the time step, processing the image to generate a first initial characterization for the time step, obtaining a final characterization for a previous time step, processing the characterization for the previous time step to generate a second initial characterization for the time step, and combining the first initial characterization and the second initial characterization to generate a final characterization for the time step.",G06T 7/00; G05B 13/02; G06T 1/40,GOOGLE LLC,"SUKTHANKAR, Rahul; GUPTA, Saurabh; DAVIDSON, James Christopher; LEVINE, Sergey Vladimir; MALIK, Jitendra","62/456,945 09.02.2017 US",EP-2018751319; KR-1020197023399; CN-201880010935.4; JP-2019543104
WO2018193363,PCT/IB2018/052643,17.04.2018,WO/2018/193363,25.10.2018,WO,DATA STRUCTURE DESCRIPTORS FOR DEEP LEARNING ACCELERATION,"Techniques in advanced deep learning provide improvements in one or more of accuracy, performance, and energy efficiency. An array of processing elements performs flow-based computations on wavelets of data. Each processing element has a respective compute element and a respective routing element. Instructions executed by the compute element include operand specifiers, some specifying a data structure register storing a data structure descriptor describing an operand as a fabric vector or a memory vector. The data structure descriptor further describes the memory vector as one of a one-dimensional vector, a four-dimensional vector, or a circular buffer vector. Optionally, the data structure descriptor specifies an extended data structure register storing an extended data structure descriptor. The extended data structure descriptor specifies parameters relating to a four- dimensional vector or a circular buffer vector.",G06N 3/08; G06N 3/063; G06N 3/04,CEREBRAS SYSTEMS INC.,"LIE, Sean; MORRISON, Michael; AREKAPUDI, Srikanth; LAUTERBACH, Gary R.; JAMES, Michael Edwin","62/486,372 17.04.2017 US; 62/517,949 11.06.2017 US; 62/520,433 15.06.2017 US; 62/522,065 19.06.2017 US; 62/522,081 19.06.2017 US; 62/542,645 08.08.2017 US; 62/542,657 08.08.2017 US; 62/580,207 01.11.2017 US; 62/628,773 09.02.2018 US; 62/628,784 09.02.2018 US; 62/652,933 05.04.2018 US; 62/655,210 09.04.2018 US",CA-3060350; EP-2018787945; JP-2019556709
