WO2014197994,PCT/CA2014/050551,12.06.2014,WO/2014/197994,18.12.2014,WO,METHOD AND SYSTEM FOR AUTOMATED QUALITY ASSURANCE AND AUTOMATED TREATMENT PLANNING IN RADIATION THERAPY,"Methods and systems for evaluating a proposed treatment plan for radiation therapy, for evaluating one or more delineated regions of interest for radiation therapy, and/or for generating a proposed treatment plan for radiation therapy. Machine learning based on historical data may be used.",A61N 5/10; A61N 5/00; G06F 19/00,UNIVERSITY HEALTH NETWORK,"PURDIE, Thomas G.; MCINTOSH, Christopher; SVISTOUN, Igor","61/834,145 12.06.2013 US",CA-2951048; EP-2014811421; US-14898060
WO2018191192,PCT/US2018/026770,09.04.2018,WO/2018/191192,18.10.2018,WO,SYSTEM FOR PREDICTING MOVEMENTS OF AN OBJECT OF INTEREST WITH AN AUTOENCODER,"Described is a system for implicitly predicting movement of an object. In an aspect, the system includes one or more processors and a memory, the memory being a non- transitory computer-readable medium having executable instructions encoded thereon, such that upon execution of the instructions, the one or more processors perform operations of providing an image of a first trajectory to a predictive autoencoder, and using the predictive autoencoder, generating a predicted tactical response that comprises a second trajectory based on images of previous tactical responses that were used to train the predictive autoencoder, and controlling a device based on the predicted tactical response.",G06T 7/20; G06K 9/00,"HRL LABORATORIES, LLC","RAHIMI, Amir, M.; KOLOURI, Soheil; BHATTACHARYYA, Rajan","62/483,916 10.04.2017 US; 62/649,893 29.03.2018 US",CN-201880015120.5; EP-2018784088
WO2016036623,PCT/US2015/047629,31.08.2015,WO/2016/036623,10.03.2016,WO,FACET RECOMMENDATIONS FROM SENTIMENT-BEARING CONTENT,"A ""Facet Recommender"" creates conversational recommendations for facets of particular conversational topics, and optionally for things associated with those facets, from consumer reviews or other social media content. The Facet Recommender applies a machine-learned facet model and optional sentiment-model, to identify facets associated with spans or segments of the content and to determine neutral, positive, or negative consumer sentiment associated with those facets and, optionally, things associated with those facets. These facets are selected by the facet model from a list or set of manually defined or machine-learned facets for particular conversational topic types. The Facet Recommender then generates new conversational utterances (i.e., short neutral, positive or negative suggestions) about particular facets based on the sentiments associated with those facets. In various implementations, utterances are fit to one or more predefined conversational frameworks. Further, responses or suggestions provided as utterances may be personalized to individual users.",G06F 17/27; G06F 17/28; G06Q 30/00; G06F 3/048; H04M 1/72; G06F 17/30,"MICROSOFT TECHNOLOGY LICENSING, LLC","DOLAN, Bill; MITCHELL, Margaret; BANERJEE, Jay; CHOUDHURY, Pallavi; HENDRICH, Susan; MASON, Rebecca; OWENS, Ron; REDDY, Mouni; SONG, Yaxiao; TOUTANOVA, Kristina; XU, Liang; YIN, Xuetao","14/475,450 02.09.2014 US",EP-2015760050; CN-201580047303.1
EP225889418,17180631,11.07.2017,3373002,12.09.2018,EP,ELECTRONIC SENSING SYSTEMS AND METHODS THEREOF,"Electronic sensing systems and methods are disclosed. The electronic sensing system (ESS) receive an olfactory product and one or more smell characteristics of the olfactory product are detected and extracted by identifying a headspace of the olfactory product. A comparison of the extracted smell characteristics with one or more smell characteristics associated with a historic training data stored in a database is performed and a match between the extracted smell characteristics and the one or more smell characteristics associated with the historic training data is determined using machine learning technique(s). Further, the ESS generates a report for the olfactory product comprising at least one of type of the consumable, name of the olfactory product, a status of the olfactory product, an age of the olfactory product, and a decaying index, and classifies the olfactory product into one or more categories based on the report and/or the historic training data.",G01N 33/02; G01N 33/00,TATA CONSULTANCY SERVICES LTD,TOMMY ROBIN; VARDEKAR ROHAN CHANDRAKANT; RAJ RISHIN,201721008355 09.03.2017 IN,
WO2017124116,PCT/US2017/013829,17.01.2017,WO/2017/124116,20.07.2017,WO,"SEARCHING, SUPPLEMENTING AND NAVIGATING MEDIA","One or more computing devices, systems, and/or methods for searching, supplementing and/or navigating media are provided. For example, a query for media may be used to identify results and provide the results based upon temporal properties of the results. In another example, media may be segmented into portions based upon time-associated text information of the media, and each portion of the media may be supplemented with content selected based upon a context of the portion. In another example, an area of a video may be selected based upon image analysis of the video, and the video may be supplemented with content at the area. In another example, a video may be supplemented with content, and properties of the content may be adjusted based upon image analysis of the video. In another example, media may be navigated through at different rates of advancement.",G06F 17/30,"BAO, Sheng; LIU, Yang","BAO, Sheng; LIU, Yang","62/279,616 15.01.2016 US; 62/446,650 16.01.2017 US",
WO2018111380,PCT/US2017/054092,28.09.2017,WO/2018/111380,21.06.2018,WO,DETERMINING INDUSTRY SIMILARITIES TO ENHANCE JOB SEARCHING,"Methods, systems, and computer programs are presented for expanding a job search that includes an industry by adding other similar industries. A method identifies job titles of members in a social network and performs, utilizing a machine-learning program, semantic analysis of the job titles to identify similarity coefficients among the job titles. The machine-learning program utilizes social network data to identify the similarity coefficients. Further, the method includes an operation for receiving a job search query, from a first member, including a query job title, and for expanding the job search query with job titles that are similar to the query job title. The method further includes operations for executing the expanded job search query to generate a plurality of job results, and for causing presentation on a display of one or more of the top job results.",G06F 17/30; G06Q 10/10; G06Q 50/00,"MICROSOFT TECHNOLOGY LICENSING, LLC","GROVER, Aman; ARYA, Dhruv; VENKATARAMAN, Ganesh; MCMANUS, Kimberly; ZHANG, Liang","15/379,641 15.12.2016 US",CN-201780077693.6
EP212749684,17001425,23.08.2017,3287917,28.02.2018,EP,DISTRIBUTED DATA GATHERING AND RECOMMENDATION IN PHYTOTHERAPY,"Prediction of the physiological effect of phytotherapeutic products and the recommendation of phytotherapeutic products on the basis of physiological effects are provided. A first product profile includes a plurality of compound identifiers and a plurality of concentrations. Observational data is read regarding a plurality of subjects who have consumed a first product substantially conforming with the first product profile. From the observational data a first set of physiological effects is determined associated with the first product profile. In some embodiments, a second set of physiological effects associated with a second product profile is determined based on the first product profile, the second product profile, and the first set of physiological effects. In other embodiments, a second product profile associated with a second set of physiological effects is determined based on the first product profile, the first set of physiological effects, and the second set of physiological effects.",G06F 19/00,CLEMMONS MICHAEL S,CLEMMONS MICHAEL S; SWEENY MATT,201662378470 23.08.2016 US,
WO2019191251,PCT/US2019/024317,27.03.2019,WO/2019/191251,03.10.2019,WO,TEXT-TO-SPEECH SYNTHESIS SYSTEM AND METHOD,"A method, computer program product, and computer system for text-to-speech synthesis is disclosed. Synthetic speech data for an input text may be generated. The synthetic speech data may be compared to recorded reference speech data corresponding to the input text. Based on, at least in part, the comparison of the synthetic speech data to the recorded reference speech data, at least one feature indicative of at least one difference between the synthetic speech data and the recorded reference speech data may be extracted. A speech gap filling model may be generated based on, at least in part, the at least one feature extracted. A speech output may be generated based on, at least in part, the speech gap filling model.",G10L 13/08; G10L 15/06; G10L 15/18,"TELEPATHY LABS, INC.","PERUCCI, Piero; REBER, Martin; AVIJEET, Vijeta","62/649,312 28.03.2018 US",
EP222933467,17196986,18.10.2017,3346423,11.07.2018,EP,DEEP CONVOLUTIONAL NETWORK HETEROGENEOUS ARCHITECTURE SYSTEM AND DEVICE,"Embodiments are directed towards a system on chip (SoC, 110) that implements a deep convolutional network heterogeneous architecture. The SoC includes a system bus (166), a plurality of addressable memory arrays coupled to the system bus (166), at least one applications processor core (128) coupled to the system bus (166), and a configurable accelerator framework (400) coupled to the system bus. The configurable accelerator framework (400) is an image and deep convolutional neural network (DCNN) co-processing system. The SoC also includes a plurality of digital signal processors (DSPs) coupled to the system bus (166), wherein the plurality of DSPs coordinate functionality with the configurable accelerator framework (400) to execute the DCNN.",G06N 3/04; G06N 3/063,ST MICROELECTRONICS SRL; ST MICROELECTRONICS INT NV,DESOLI MR GIUSEPPE; BOESCH MR THOMAS; CHAWLA MR NITIN; SINGH MR SURINDER PAL; GUIDETTI MR ELIO; DE AMBROGGI MR FABIO GIUSEPPE; MAJO MR TOMMASO; ZAMBOTTI MR PAOLO SERGIO,201711000422 04.01.2017 IN; 201715423272 02.02.2017 US,
WO2019222833,PCT/CA2019/000078,24.05.2019,WO/2019/222833,28.11.2019,WO,QUANTIFYING MOTOR FUNCTION USING BEG SIGNALS,"A motor control score is automatically generated for a subject based on electroencephalography (EEG) data represented as a plurality of EEG waveforms obtained from a plurality of EEG electrodes. Each waveform is separated into at least one window, containing a portion of the EEG waveform representative of neural activity corresponding to a movement performed by the subject. At least one or more frequency components and/or signal components are determined from the EEG data in the window, and a motor control score is determined based on these components. The frequency components may correspond to event-related desynchronization (ERD) response frequency band and event-related synchronization (ERS) response frequency band. In other embodiments, the frequency components correspond to a phase response and the signal components correspond to a signal power spectrum density of the window, which are provided to a primary neural network model to determine the motor control score.",A61B 5/0476; A61B 5/00; A61B 5/16,HEALTHTECH CONNEX INC.,"D'ARCY, Ryan, Clarke, Newell; ZHANG, Xin; MENON, Carlo; FREHLICK, Zachary; TANNOURI, Pamela","62/675,866 24.05.2018 US; 62/700,416 19.07.2018 US",
WO2001050330,PCT/US2001/000551,08.01.2001,WO/2001/050330,12.07.2001,WO,SYSTEM AND METHOD OF DECISION MAKING,"The present invention relates to information systems theories and expert systems theories. The present invention provides a process, apparatus and method for decision making, based on emulation of the human decision-making process using expert-generated primary bias values, wherein a primary bias value associates a particular alternative possibility of a possibility set with a particular query, and reflects the expert s conception of the relative degree of predictive value of the query for the particular alternative relative to other alternatives in the possibility set. In particular embodiments, the present invention provides a process, apparatus and method for providing a medical diagnosis or medical self-assessment.",G06Q 50/00; G06F 19/00; G06N 5/04,"IGOTPAIN.COM, INC.","AHMED, Sajid","60/175,106 06.01.2000 US",AU-32747/01; MX-PA/a/2002/006733; IL-150591; JP-2001550621; KR-1020027008797; IN-IN/PCT/2002/958/KOL; CN-01804725.4; EP-2001904797; CA-2396573
WO2018094295,PCT/US2017/062434,18.11.2017,WO/2018/094295,24.05.2018,WO,ADAPTIVE ATTENTION MODEL FOR IMAGE CAPTIONING,"The technology disclosed presents a novel spatial attention model that uses current hidden state information of a decoder long short-term memory (LSTM) to guide attention and to extract spatial image features for use in image captioning. The technology disclosed also presents a novel adaptive attention model for image captioning that mixes visual information from a convolutional neural network (CNN) and linguistic information from an LSTM. At each timestep, the adaptive attention model automatically decides how heavily to rely on the image, as opposed to the linguistic model, to emit the next caption word. The technology disclosed further adds a new auxiliary sentinel gate to an LSTM architecture and produces a sentinel LSTM (Sn-LSTM). The sentinel gate produces a visual sentinel at each timestep, which is an additional representation, derived from the LSTM's memory, of long and short term visual and linguistic information.",G06N 3/04,"SALESFORCE.COM, INC.","LU, Jiasen; XIONG, Caiming; SOCHER, Richard","62/424,353 18.11.2016 US; 15/817,153 17.11.2017 US; 15/817,161 17.11.2017 US; 15/817,165 18.11.2017 US",
EP222892896,17202654,20.11.2017,3340120,27.06.2018,EP,SOLVING MATRIX INVERSE PROBLEMS USING NEUROMORPHIC COMPUTING,"A spiking neural network (SNN) is defined that includes artificial neurons interconnected by artificial synapses, the SNN defined to correspond to one or more numerical matrices in an equation such that weight values of the synapses correspond to values in the numerical matrices. An input vector is provided to the SNN to correspond to a numerical vector in the equation. A steady state spiking rate is determined for at least a portion of the neurons in the SNN and an approximate result of a matrix inverse problem corresponding to the equation is determined based on values of the steady state spiking rates.",G06N 3/04; G06N 3/063,INTEL CORP,LIN TSUNG-HAN; SRINIVASA NARAYAN,201615385504 20.12.2016 US,
EP222933430,17208104,18.12.2017,3346391,11.07.2018,EP,DISTRIBUTED CONVOLUTION FOR NEURAL NETWORKS,"In one embodiment, a matrix operation may be performed using a plurality of input matrices, wherein the matrix operation is associated with one or more convolution operations. The plurality of input matrices may be partitioned into a plurality of input partitions, wherein the plurality of input matrices is partitioned based on a number of available processing elements. The plurality of input partitions may be distributed among a plurality of processing elements, wherein each input partition is distributed to a particular processing element of the plurality of processing elements. A plurality of partial matrix operations may be performed using the plurality of processing elements, and partial matrix data may be transmitted between the plurality of processing elements while performing the plurality of partial matrix operations. A result of the matrix operation may be determined based on the plurality of partial matrix operations.",G06F 17/15,INTEL CORP,KORTHIKANTI VIJAY ANAND R; KALAIAH ARAVIND; WERNER TONY L; KLOSS CAREY K; KHOSROWSHAHI AMIR,201615395675 30.12.2016 US,
EP222933432,17207877,15.12.2017,3346392,11.07.2018,EP,DISTRIBUTED MATRIX MULTIPLICATION FOR NEURAL NETWORKS,"In one embodiment, a matrix operation associated with a plurality of input matrices may be performed. The plurality of input matrices may be partitioned into a plurality of input partitions, wherein the plurality of input matrices is partitioned based on a number of available processing elements. The plurality of input partitions may be distributed among a plurality of processing elements, wherein each input partition is distributed to a particular processing element of the plurality of processing elements. A plurality of partial matrix operations may be performed using the plurality of processing elements, and partial matrix data may be transmitted between the plurality of processing elements while performing the plurality of partial matrix operations. A result of the matrix operation may be determined based on the plurality of partial matrix operations.",G06F 17/16,INTEL CORP,KORTHIKANTI VIJAY ANAND R; KLOSS CAREY K; KALAIAH ARAVIND; KHOSROWSHAHI AMIR,201615395527 30.12.2016 US,
EP246633927,17843971,24.08.2017,3505310,03.07.2019,EP,MOBILE ROBOT AND CONTROL METHOD THEREFOR,"The mobile robot according to one aspect of the present invention comprises: a drive unit for moving a main body; an image obtainment unit for obtaining images around the main body; a storage unit for storing the images obtained by the image obtainment unit; a sensor unit comprising one or more sensors for sensing obstacles during travel; and a control unit for controlling such that partial areas are extracted from the images obtained by the image obtainment unit so as to correspond to the directions of the obstacles sensed by the sensor unit, the mobile robot thus being capable of extracting efficient data for machine learning and obstacle attribute recognition.",B25J 11/00; A47L 9/28; B25J 9/00; B25J 9/16; B25J 19/02,LG ELECTRONICS INC,NOH DONGKI; LEE JUHYEON; KIM JUNGHWAN; BAEK SEUNGMIN; YANG WONKEUN,20160108384 25.08.2016 KR; 20160108385 25.08.2016 KR; 20160108386 25.08.2016 KR; 2017009257 24.08.2017 KR,
WO2019157257,PCT/US2019/017175,08.02.2019,WO/2019/157257,15.08.2019,WO,SYSTEM AND METHOD FOR PSEUDO-TASK AUGMENTATION IN DEEP MULTITASK LEARNING,"A multi-task (MTL) process is adapted to the single-task learning (STL) case, i.e., when only a single task is available for training. The process is formalized as pseudo-task augmentation (PTA), in which a single task has multiple distinct decoders projecting the output of the shared structure to task predictions. By training the shared structure to solve the same problem in multiple ways, PTA simulates the effect of training towards distinct but closely-related tasks drawn from the same universe. Training dynamics with multiple pseudo-tasks strictly subsumes training with just one, and a class of algorithms is introduced for controlling pseudo-tasks in practice.",G06N 3/00; G06N 3/02; G06N 3/04; G06N 3/06; G06N 3/063; G06N 3/067; G06N 3/08,COGNIZANT TECHNOLOGY SOLUTIONS U.S. CORPORATION,"MEYERSON, Elliot; MIIKKULAINEN, Risto","62/628,248 08.02.2018 US; 62/684,125 12.06.2018 US",
WO2018094294,PCT/US2017/062433,18.11.2017,WO/2018/094294,24.05.2018,WO,SPATIAL ATTENTION MODEL FOR IMAGE CAPTIONING,"The technology disclosed presents a novel spatial attention model that uses current hidden state information of a decoder long short-term memory (LSTM) to guide attention and to extract spatial image features for use in image captioning. The technology disclosed also presents a novel adaptive attention model for image captioning that mixes visual information from a convolutional neural network (CNN) and linguistic information from an LSTM. At each timestep, the adaptive attention model automatically decides how heavily to rely on the image, as opposed to the linguistic model, to emit the next caption word. The technology disclosed further adds a new auxiliary sentinel gate to an LSTM architecture and produces a sentinel LSTM (Sn-LSTM). The sentinel gate produces a visual sentinel at each timestep, which is an additional representation, derived from the LSTM's memory, of long and short term visual and linguistic information.",G06N 3/04,"SALESFORCE.COM, INC.","LU, Jiasen; XIONG, Caiming; SOCHER, Richard","62/424,353 18.11.2016 US; 15/817,153 17.11.2017 US; 15/817,161 17.11.2017 US; 15/817,165 18.11.2017 US",CA-3040165; CN-201780071579.2; EP-2017821750
WO2019222759,PCT/US2019/033178,20.05.2019,WO/2019/222759,21.11.2019,WO,RECURRENT MULTIMODAL ATTENTION SYSTEM BASED ON EXPERT GATED NETWORKS,"Systems and methods for multimodal classification include a plurality of expert modules, each expert module configured to receive data corresponding to one of a plurality of input modalities and extract associated features, a plurality of class prediction modules, each class prediction module configured to receive extracted features from a corresponding one of the expert modules and predict an associated class, a gate expert configured to receive the extracted features from the plurality of expert modules and output a set of weights for the input modalities, and a fusion module configured to generate a weighted prediction based on the class predictions and the set of weights. Various embodiments include one or more of an image expert, a video expert, an audio expert, class prediction modules, a gate expert, and a co-learning framework.",G06K 9/62; G06N 3/02,SYNAPTICS INCORPORATED; TRUSTEES OF INDIANA UNIVERSITY,"NESTA, Francesco; GUO, Lijiang; KIM, Minje","62/673,801 18.05.2018 US",
WO2020072700,PCT/US2019/054365,02.10.2019,WO/2020/072700,09.04.2020,WO,HLA SINGLE ALLELE LINES,"Adaptive immune responses rely on the ability of cytotoxic T cells to identify and eliminate cells displaying disease-specific antigens on human leukocyte antigen (HLA) class I molecules. Investigations into antigen processing and display have immense implications in human health, disease and therapy. To extend understanding of the rules governing antigen processing and presentation, immunopurified peptides from B cells, each expressing a single HLA class I allele, were profiled. A resource dataset containing thousands of peptides bound to distinct class I HLA- A, -B, and -C alleles was generated by implementing a novel allele-specific database search strategy. Applicants discovered new binding motifs, established the role of gene expression in peptide presentation and improved prediction of HLA-peptide binding by using these data to train machine-learning models. These streamlined experimental and analytic workflows enable direct identification and analysis of endogenously processed and presented antigens.",A61K 35/15; A61K 39/00; G01N 33/569,"DANA-FARBER CANCER INSTITUTE, INC.; THE GENERAL HOSPITAL CORPORATION; THE BROAD INSTITUTE, INC.; KESKIN, Derin; SARKIZOVA, Siranush; CARR, Steven; WU, Catherine J.; CLAUSER, Karl","KESKIN, Derin; SARKIZOVA, Siranush; CARR, Steven; WU, Catherine J.; CLAUSER, Karl; KLAEGER, Susan; HACOHEN, Nir","62/740,324 02.10.2018 US; 62/852,924 24.05.2019 US",
WO2018195691,PCT/CN2017/081619,24.04.2017,WO/2018/195691,01.11.2018,WO,NEW CONNECTION RECOMMENDATIONS BASED ON DATA ATTRIBUTES,"Methods, systems, and computer programs are presented for recommending new connections based on profile similarity and existing interconnections within a social network. One method includes an operation for detecting a request for new connections for a member of the social network, where the profile of the member includes values for certain attributes. Additionally, the method includes operations for identifying members that have at least one equal attribute to the attributes of the member, and for calculating a connection score for each identified member based on the respective values of the identified members attributes. Members are selected from the identified members based on the connection scores, and a ranking score for each selected member is obtained utilizing a machine learning algorithm that utilizes similarity analysis of the attributes to calculate the ranking score. The selected members are presented to the member as the possible new connections based on the ranking scores.",G06F 17/30,"MICROSOFT TECHNOLOGY LICENSING, LLC; ZHANG, Liang","ZHANG, Liang; ZHU, Lin; WANG, Di; ZHAO, Sheng; LIU, Yang; CHEN, Shu",,CN-201780000421.6; US-15543361
WO2016195847,PCT/US2016/029462,27.04.2016,WO/2016/195847,08.12.2016,WO,METHOD FOR ENFORCING ENDPOINT HEALTH STANDARDS,"An approach for enforcing standards regarding security vulnerabilities for an endpoint user device associated with a user includes collecting, at an inline frame implemented with a web application, endpoint health data of the endpoint user device in response to the user interfacing with the web application through the endpoint user device, generating endpoint health intelligence from the endpoint health data, the endpoint health intelligence indicating endpoint security health of the endpoint user device, generating a first endpoint health notification comprising the endpoint health intelligence, and notifying an administrator of network with the first endpoint health notification.",G06F 17/00; G06F 21/00; H04L 29/06; H04L 9/32,"DUO SECURITY, INC.","OBERHEIDE, Jon; SONG, Douglas","62/169,254 01.06.2015 US",EP-2016803903
WO2019177951,PCT/US2019/021582,11.03.2019,WO/2019/177951,19.09.2019,WO,HYBRID QUANTUM-CLASSICAL GENERATIVE MODES FOR LEARNING DATA DISTRIBUTIONS,"Hybrid quantum-classical generative models for learning data distributions are provided. In various embodiments, methods of and computer program products for operating a Helmholtz machine are provided. In various embodiments, methods of and computer program products for operating a generative adversarial network are provided. In various embodiments, methods of and computer program products for variational autoencoding are provided.",G06N 3/04; G06N 3/08; G06N 10/00,PRESIDENT AND FELLOWS OF HARVARD COLLEGE,"ASPURU-GUZIK, Alan; CAO, Yudong; JOHNSON, Peter, D.","62/641,371 11.03.2018 US; 62/683,276 11.06.2018 US",
