WO2018170348,PCT/US2018/022778,16.03.2018,WO/2018/170348,20.09.2018,WO,METHODS FOR TARGET DNA DETECTION USING NON-FUNCTIONALIZED CARBOHYDRATE-CAPPED METALLIC NANOPARTICLES,"The disclosure relates to a method for specific detection of a target analyte using probe DNA specific to the target analyte and non-functionalized, carbohydrate-capped metal nanoparticles such as non-functionalized, dextrin-capped gold nanoparticles. A sample mixture including a target DNA analyte and a probe DNA specific thereto is incubated to from a probe DNA-target DNA complex. The non-functionalized, carbohydrate-capped metal nanoparticles and an ionic species such as sodium chloride or other salt are added to the probe DNA-target DNA complex, and the mixture is incubated. Addition of the ionic species creates a detectable distinction, such as color of the resultant mixture, between stabilized metal nanoparticles when the probe DNA-target DNA complex is present and destabilized metal nanoparticles when the probe DNA-target DNA complex is absent. The method can be used for colorimetric detection of plant pathogens and associated diseases in agricultural production systems.",C12Q 1/68; B32B 5/16; G01N 33/543,BOARD OF TRUSTEES OF MICHIGAN STATE UNIVERSITY,"DAY, Robert; BAETSEN-YOUNG, Amy; ALOCILJA, Evangelyn, C.","62/558,421 14.09.2017 US; 62/472,661 17.03.2017 US",
WO2000016096,PCT/GB1999/002870,14.09.1999,WO/2000/016096,23.03.2000,WO,ARTIFICIAL OLFACTORY SENSING SYSTEM,"An artificial olfactory sensing system is provided comprising a sensor array (10) including volume-change sensors (12) and mass-change sensors (14), the responses of which sensors may be combined to provide an output characteristic of the molecular density of the analyte. Vapour to be analysed is passed into a sensor chamber (32) containing multiple chemoresistor volume-change sensors (12) and quartz microbalance crystal sensors (14). The responses are analysed by computer (30), as hardware or a neural network. The chemoresistors (12) are fabricated from a non-conductive polymer doped into conductive carbon black, as multifingered interdigitated electrodes. Also described is a system and method for detecting an analyte in a fluid.",G01N 33/00,"THE MINISTER OF AGRICULTURE, FISHERIES & FOOD IN HER BRITANNIC MAJESTY'S GOVERNMENT OF THE UNITED KINGDOM OF GREAT BRITAIN AND NORTHERN IRELAND       Ministry of Agriculture, Fisheries & Food; COOPER, Jonathan; SWANN, Marcus, Jack; GLIDLE, Andrew; CUI, Li; BARKER, John, Reginald","COOPER, Jonathan; SWANN, Marcus, Jack; GLIDLE, Andrew; CUI, Li; BARKER, John, Reginald",9820009.0 14.09.1998 GB,
WO2018064465,PCT/US2017/054277,29.09.2017,WO/2018/064465,05.04.2018,WO,COMPOUNDS FOR INCREASING NEURAL PLASTICITY,"The present invention provides a method of using non-hallucinogenic analogs of psychedelic compounds for increasing neural plasticity of the neuronal cell, and a method of using thereof for treating a brain disorder.",G01N 33/50,THE REGENTS OF THE UNIVERSITY OF CALIFORNIA,"OLSON, David, E.","62/401,641 29.09.2016 US",EP-2017857489
WO2018213308,PCT/US2018/032766,15.05.2018,WO/2018/213308,22.11.2018,WO,COMBINATION BIOLOGIC AND CYBER-FOOTPRINT SYSTEM FOR DETERMINING COMPATIBILITY BETWEEN AND AMONG INDIVIDUALS AND GROUPS,"The present invention provides novel approaches to combining specific phenotypic and genotypic biological information, individual and group cyber-footprints, and physical characteristics into a computationally-derived formulation capable of creating a science-based spectrum of compatibility with which to increase the likelihood of a successful, enduring and healthy couple and/or group relationship.",C12Q 1/68; C12Q 1/6827; C12Q 1/6881; G01N 33/80; G06F 19/18; G06F 19/24,"PHERAMOR, INC.; BARRETO, Brittany; MIRZA, Asma; HUANG, Bin","BARRETO, Brittany; MIRZA, Asma; HUANG, Bin","62/506,254 15.05.2017 US",
EP11086457,08290535,10.06.2008,2133829,16.12.2009,EP,Simulation of complex systems,"The invention provides a software architecture for generating and self-assembling multi-scale computer models of dynamic systems, in a way that mimics (bottom-up) morphogenesis in living organisms, but with the addition of (top-down) constraints that result in efficient model generation. Once generated, the model can be used for simulations within the same software architecture. Exemplary applications include the generation of models for the simulation of: human cells / organs; non-living physical artefacts; business processes; urban environments; nanotech structures. Non-modelling applications for the architecture are also envisaged, including: data mining applications; decision making; e-learning/training and self-programming agents.  The architecture itself comprises a collection of nested physical objects (""FUs"") and a related, parallel collection of nested agents (""PSUs"") that can act on the physical objects.",G06N 7/06,INTEGRATIVE BIOCOMPUTING S A R,SIREGAR PRIDI,08290535 10.06.2008 EP,
WO2002080079,PCT/IB2002/002079,28.03.2002,WO/2002/080079,10.10.2002,WO,SYSTEM AND METHOD FOR THE DETECTION OF GENETIC INTERACTIONS IN COMPLEX TRAIT DISEASES,"The present invention comprises a method and system for the analysis of genetic and other data, using Multidimensional Data Mining, to identify specific combinations of loci and other factors which contribute to complex traits in any plant, organism, or animal, including mice and humans. Complex traits include the presence, susceptibility to, resistance to cancer and other disease states. The method and system can be used to detect individuals at high risk of disease within families carrying clusters of susceptibility alleles, or in the general population. After the identification of the disease-associated alleles, the information can be used for drug development.",G06F 17/30,"INTELLIDAT CORPORATION; BALMAIN, Alan; HEALEY, Lee, Anne; REIJERSE, Fidel","BALMAIN, Alan; HEALEY, Lee, Anne; REIJERSE, Fidel","60/279,320 28.03.2001 US",JP-null
WO2005069187,PCT/EP2005/000090,07.01.2005,WO/2005/069187,28.07.2005,WO,METHODS AND SYSTEM FOR THE IDENTIFICATION AND CHARACTERIZATION OF PEPTIDES AND THEIR FUNCTIONAL RELATIONSHIPS BY USE OF MEASURES OF CORRELATION,"The invention provides methods and a system implementing these methods for identifying and characterizing peptides and their functional relationships by use of measures of correlation. These methods are based on the interaction of a Correlation Associated Network Module with several Application Modules including a Sequence Network Module, a Differential Network Module, a Marker Panel Network Module and a Surrogate Network Module allowing e.g. the provision of a representative overview of the peptide content of biological samples, the prediction of peptide sequences, the identification of peptides suitable to be used as marker panels and the identification of peptides suitable as surrogates for a known peptide.",C07K 14/47; C12Q 1/68; G01N 33/68; G01N 33/94; G06F 19/00,"DIGILAB BIOVISION GMBH; ZUCHT, Hans-Dieter; LAMERZ, Jens; KHAMENIA, Valery","ZUCHT, Hans-Dieter; LAMERZ, Jens; KHAMENIA, Valery",04000170.3 07.01.2004 EP,CA-2553172; DE-null; EP-2005706844; JP-2006548227; US-10585380
EP249469734,19150264,03.01.2019,3518147,31.07.2019,EP,REDUCED FALSE POSITIVE IDENTIFICATION FOR SPECTROSCOPIC CLASSIFICATION,,G06K 9/20; G01N 21/359; G06K 9/62,VIAVI SOLUTIONS INC,HSIUNG CHANGMENG; PEDERSON CHRISTOPHER G; VON GUNTEN MARC K; SUN LAN,201816130732 13.09.2018 US; 201862622637 26.01.2018 US,
WO2004044839,PCT/US2002/038216,12.11.2002,WO/2004/044839,27.05.2004,WO,PREDICTION OF ESTROGEN RECEPTOR STATUS OF BREST TUMORS USING BINARY PREDICTION TREE MODELING,,G06N 3/12,DUKE UNIVERSITY,"WEST, Mike; NEVIUS, Joseph","60/424,715 08.11.2002 US",JP-null; EP-2002808139
WO2016098023,PCT/IB2015/059690,16.12.2015,WO/2016/098023,23.06.2016,WO,"MULTI-SENSOR, AUTONOMOUS ROBOTIC VEHICLE WITH LAWN CARE FUNCTION","A robotic vehicle may include one or more functional components configured to execute a lawn care function, a sensor network comprising one or more sensors configured to detect conditions proximate to the robotic vehicle, an object detection module configured to 5 detect objects proximate to the robotic vehicle using contact-less detection, a positioning module configured to determine robotic vehicle position, and a mapping module configured to generate map data regarding a parcel on which the robotic vehicle operates.",G05D 1/02,HUSQVARNA AB,"GRUFMAN, Stefan; MANNEFRED, Björn; JÄGENSTEDT, Patrik; ÖHRLUND, Magnus; DEIMERT, Johan","62/093,112 17.12.2014 US",EP-2015825957; US-15535500
WO2014047723,PCT/CA2013/000822,26.09.2013,WO/2014/047723,03.04.2014,WO,GENE EXPRESSION PROFILING FOR PROGNOSIS OF NON-SMALL CELL LUNG CANCER,"Twenty-two (22) genes associated with survival were identified using univariate Cox proportional hazards regression analyses (false discovery rate < 1%). Significant genes were then validated by quantitative real-time PCR (qPCR) in the same lung specimens in order to develop a qPCR assay with optimal discriminatory performance. Six risk models were developed from qPCR-based gene expression levels which allowed delineation of a high-risk group following stage I adenocarcinoma resection (Kaplan-Meier log-rank p < 0.005). The lock down qPCR-based models were then validated in a new set of 206 non-tumor lung specimens explanted from patients with confirmed stage I adenocarcinoma. The best risk model was based on the mRNA expression level of a single gene, namely KN motif and ankyrin repeat domains 4 (KANK4) (Kaplan-Meier log-rank p = 0.0006) and outperformed predictor of survival based on current pathologic staging (Wilcoxon rank sum test p < 1E-5). This new qPCR assay is needed in clinical setting to identify high-risk patients following stage I adenocarcinoma resection that will benefit from adjuvant chemotherapy.",C12Q 1/68; C40B 30/04; C40B 40/06; G01N 33/48,"UNIVERSITE LAVAL; BOSSE, Yohan; LAVIOLETTE, Michel; JOUBERT, Philippe; CARRIER, Jean-Sebastien","BOSSE, Yohan; LAVIOLETTE, Michel; JOUBERT, Philippe; CARRIER, Jean-Sebastien","61/706,261 27.09.2012 US",
WO2020044480,PCT/JP2018/032066,30.08.2018,WO/2020/044480,05.03.2020,WO,"SERVER DEVICE OF CROP GROWTH STAGE DETERMINATION SYSTEM, CROP GROWTH DETERMINATION METHOD, AND PROGRAM",The purpose of the present invention is to nondestructively determine the growth state of a crop simply with high accuracy. The present invention is provided with: an image data input unit 11 for inputting in plurality image information in which a crop is imaged; a stage information input unit 12 for inputting information that indicates the growth stage of the crop for each of the plurality of inputted image information pieces; a learning unit 14 for performing deep learning for correlating the image of the crop to the growth stage on the basis of the plurality of inputted image information pieces and the information indicating the growth stage; an image input unit 16 for inputting image information in which a crop the growth stage of which is unknown is imaged; a growth stage determination unit 10 for determining a growth stage for the image information inputted by the image input unit 16 on the basis of the result of learning by the learning unit 14; and a determination result output unit 17 for outputting the growth stage determined by the growth stage determination unit 10.,G06Q 50/02; A01G 7/00; G06T 7/00,"NTT DATA CCS CORPORATION; 株式会社エヌ・ティ・ティ・データＣＣＳ; IWASAWA, Norio; 岩澤　紀生","IWASAWA, Norio; 岩澤　紀生; MIO, Aritoshi; 三尾　有年; HARA, Seiichi; 原　誠一; SHIMOJO, Hiroto; 下城　洋人; TAKEMOTO, Hiroshi; 竹本　宏",,
EP243362285,17206438,11.12.2017,3494877,12.06.2019,EP,DEVICE FOR THE EXAMINATION OF NEURONS,,A61B 5/04; C12M 3/06,NMI NATURWISSENSCHAFTLICHES UND MEDIZINISCHES INSTITUT AN DER UNIV TUEBINGEN,CESARE PAOLO; JONES PETER; MOLINA MARTINEZ BEATRIZ,17206438 11.12.2017 EP,
WO2019115320,PCT/EP2018/083715,06.12.2018,WO/2019/115320,20.06.2019,WO,DEVICE FOR THE EXAMINATION OF NEURONS,"The present invention relates to a device for the examination of neurons and to a method for examining neurons, and more specifically for examining neurons growing in a three- dimensional network.",A61B 5/04; C12M 3/06,NMI NATURWISSENSCHAFTLICHES UND MEDIZINISCHES INSTITUT AN DER UNIVERSITAET TUEBINGEN,"CESARE, Paolo; JONES, Peter; MARTINEZ, Beatriz Molina",17206438.8 11.12.2017 EP,
WO2001088510,PCT/US2001/015667,16.05.2001,WO/2001/088510,22.11.2001,WO,PRE-AND POST-PROCESSING OF SPECTRAL DATA FOR CALIBRATION USING MULTIVARIATE ANALYSIS TECHNIQUES,This invention relates to a method for quantitating the relationship between an analyte level in in vivotissue and the auto-fluorescent spectral characteristics in the tissue.,A61B 5/00; G01N 21/64,"ARGOSE, INC.; BUSHMAKIN, Andrew; TREPAGNIER, Pierre; MANSFIELD, James","BUSHMAKIN, Andrew; TREPAGNIER, Pierre; MANSFIELD, James","60/205,103 18.05.2000 US",
WO2011131490,PCT/EP2011/055406,07.04.2011,WO/2011/131490,27.10.2011,WO,CURVE PROCESSOR ALGORITHM FOR THE QUALITY CONTROL OF (RT-)qPCR CURVES,"The invention is in the field of analytical technology and relates to an improved procedure for determining the concentration or activity of an analyte in a sample. Specifically the invention provides an automated algorithm for the quality control of (RT-)qPCR reactions. Plotting the fluorescence intensity of a reporter dye divided by the fluorescence intensity of a passive reference dye against the cycle number leads to a so-called sigmoid function which is characterized by a background phase, an exponential growth phase and a plateau phase. Since the fluorescence intensity as a function of cycles relates to the initial number of template molecules in the sample, qPCR curves can be used to quantify the amount of RNA or DNA fragments in the sample by determination of a so-called Cq value.",G06F 19/24; C12Q 1/68,"SIEMENS HEALTHCARE DIAGNOSTICS INC.; DARTMANN, Mareike; WEBER, Karsten; ALTMANN, Gabriela; FEDER, Inke Sabine; ROPERS, Tanja; ROTH, Claudia","DARTMANN, Mareike; WEBER, Karsten; ALTMANN, Gabriela; FEDER, Inke Sabine; ROPERS, Tanja; ROTH, Claudia",10160573.1 21.04.2010 EP,EP-2011714518; US-13642358
WO2018051185,PCT/IB2017/001300,13.09.2017,WO/2018/051185,22.03.2018,WO,METHOD AND APPARATUS FOR RANKING ELECTRONIC INFORMATION BY SIMILARITY ASSOCIATION,"Systems and methods are provided for ranking electronic information based on determined similarities. In one aspect a set of unique features are determined from a collection of electronic objects. A graph is constructed in which electronic object are represented as object nodes and determined features are represented as feature nodes. The object nodes are interconnected by a weighted edge to at least one feature node. Scores for the object nodes and the feature nodes are computed using a determined set of anchor nodes and a determined weighted adjacency matrix. The object nodes and the feature nodes of the graph are ranked and displayed based on the computed scores. In one aspect, the scores and the ranks for the object nodes and the feature nodes are dynamically updated and displayed based on user preferences.",G06F 17/30,ALCATEL LUCENT; ALCATEL-LUCENT USA INC.,"KENNEDY, William; SANIEE, Iraj; WHITE, Christopher Alan; ZHANG, Yihao Lisa; WILFONG, Gordon Thomas; YU, Chun-Nam; NITHI, Nachi K","15/267,405 16.09.2016 US",EP-2017791727; CN-201780066450.2
WO2018144782,PCT/US2018/016522,01.02.2018,WO/2018/144782,09.08.2018,WO,METHODS OF DETECTING SOMATIC AND GERMLINE VARIANTS IN IMPURE TUMORS,"A system is provided that considers allele fraction shifts as a function of copy number and clonal heterogeneity. The system leverages differences between allele frequencies to differentiate between somatic and normal variants in impure tumor samples. In solid tumors, stromal cells and infiltrating lymphocytes are typically interspersed among the tumor cells. The normal cell contamination in tumors can be leveraged to differentiate somatic from germline variants. We explicitly model allelic copy number and clonal sample fractions so that we can examine how these factors impact the power to detect somatic variants. The system models the copy number alterations, which can also affect the allele frequencies of both somatic and germline variants. The expected allele frequencies can be calculated. The expected allele frequencies for somatic and germline differ with tumor content for different copy number alterations.",G06F 19/10; G06F 19/18; G06F 19/22; G06F 19/28; G01N 33/574; C12Q 1/68,THE TRANSLATIONAL GENOMICS RESEARCH INSTITUTE,"HALPERIN, Rebecca; CRAIG, David","62/453,492 01.02.2017 US",
WO2009066131,PCT/IB2007/054691,19.11.2007,WO/2009/066131,28.05.2009,WO,"METHODS FOR PREPARATION OF VACCINES, LABORATORY KITS, AND TREATMENT COMPONENTS","The present invention relates to methods for producing a number of products. Those products include vaccines, clinical laboratory kits and treatment components. The vaccine products cover: vaccines for bacteria, viruses and parasites in humans and animals; and vaccines for the prevention of malignant tumors in patients showing malignant transformation or as a supportive treatment of patients already having a tumor. The clinical laboratory kits covers: diagnostic kits for efficient diagnosis of diseases caused by microorganisms in humans and animals; diagnostic kits for malignant tumors; tissue typing kits for organ transplantation; and monitoring kits for organ rejection and hypersensitivity. The treatment components will help in treatment of difficult disorders including, among others, hypersensitivity disorders, chronic graft rejection, and autoimmune disorders. In effect, the products that can be produced based on this discovery are innumerable. The invention methods are based on our discovery of a new function for RBCs which is their ability to selectively transport self and foreign antigens.",G01N 33/50; A61K 39/00,"RAFEA, Mahmoud","RAFEA, Mahmoud",,
EP11112213,09075498,29.04.1999,2156734,24.02.2010,EP,A piezo-sensor for a milking implement,"The invention relates to a sensor for measuring the amplitude difference and/or the intensity value of sound, said sensor being provided with a piezo-sensor (4), such as a piezoelectric transducer (12),  characterized in that  the sensor (4) comprises a housing (5) which is made of a material having a strongly absorbing capacity for sound and/or vibrations, such as silicones, for example, while at least one piezoelectric sensor (12) is embedded in said housing (5).",A01J 5/04; G01H 1/00; A01J 5/007; B06B 3/00; G01H 11/08; G05B 23/02; G10K 11/00; G10L 15/00; G10L 15/10,MAASLAND NV,VAN DEN BERG KAREL; OORT DICK MARIUS,06076811 29.04.1999 EP; 99201330 29.04.1999 EP; 1009052 01.05.1998 NL; 1010369 21.10.1998 NL,
WO2004048937,PCT/US2003/038186,25.11.2003,WO/2004/048937,10.06.2004,WO,ELECTRO-OPTICAL NUCLEIC ACID-BASED SENSOR ARRAY AND METHOD FOR DETECTING ANALYTES,"The present invention is directbd to methods of detection, identification and monitoring of vapor phase analytes by using sensor arrays comprising fluorophore labeled nucleic acids, dried onto a substrate which react with vapor phase analytes. Methods of using and preparing such sensor arrays are also provided.",C12M 1/34; G01N 33/543; G01N 33/551,"TUFTS UNIVERSITY; WHITE, Joel, E.; KAUER, John, S.","WHITE, Joel, E.; KAUER, John, S.","60/428,869 25.11.2002 US; 10/303,548 25.11.2002 US",CA-2547331; US-10535748; JP-2004555829; EP-2003799861
WO2018212790,PCT/US2017/068647,28.12.2017,WO/2018/212790,22.11.2018,WO,ESTIMATED QUERY PERFORMANCE,"Operations include estimating, in real time, a runtime of a query. The query optimization system receives set of query definitions for defining a target query. The system uses the set of query definition elements to determine an estimated runtime for the target query. If the estimated runtime exceeds some acceptable threshold value, then the system determines a modification to the set of query definition elements. The system uses the modification to generate a modified query, corresponding to a lower estimated runtime.",G06F 17/30,ORACLE INTERNATIONAL CORPORATION,"IGNATYEV, Oleksiy; BOHACIAK, Ondrej","15/598,600 18.05.2017 US",
WO2019092418,PCT/GB2018/053228,07.11.2018,WO/2019/092418,16.05.2019,WO,METHOD OF COMPUTER VISION BASED LOCALISATION AND NAVIGATION AND SYSTEM FOR PERFORMING THE SAME,"In relation to the field of vehicle navigation, we describe a method of determining a position of a subject (such as a vehicle, platform or target), comprising the steps of obtaining and storing an object dataset comprising object data indicative of one or more objects in an environment, including an indication of object parameters associated with the or each object, the object parameters including one or more of location, orientation, one or more dimensions, and a type associated with the object, obtaining environment data indicative of a region of the environment from a sensor associated with the subject, determining the presence of an observed object in the environment data, including determining one or more equivalent observed object parameters associated with the observed object, and determining the position of the subject based on a comparison of the observed object parameters with the equivalent object parameters of the objects in the object dataset.",G01C 21/00; G01C 21/20; G01C 21/32; G01S 5/16; G05D 1/02; G06T 7/70,HORIBA MIRA LIMITED,"MALONEY, Andrew",1718628.9 10.11.2017 GB,
WO2000027281,PCT/US1999/025450,28.10.1999,WO/2000/027281,18.05.2000,WO,DETERMINING THE LOCATION AND ORIENTATION OF AN INDWELLING MEDICAL DEVICE,"A device (100) to detect the location of a plurality of magnets uses a plurality of magnetic sensors (108, 110, 112, 114), having sensor elements arranged in a known fashion. Each sensor element (108, 110, 112, 114) senses the magnetic field strength generated by each of the plurality of magnets (120, 302, 306) and provides data indicative of the direction of the magnets in a three-dimensional space. The device uses fundamental equations for electricity and magnetism that relate the measured magnetic field strength to the location and strength of the magnetic dipole for each of the plurality of magnets. The device may use an iterative process to determine the actual location and orientation of each magnet. An initial estimation of the location and orientation of each magnet results in the generation of predicted magnetic field values. The predicted magnetic field values are compared with the actual measured values provided by the magnetic sensors. Based on a difference between the predicted values and the measured values, the device estimates a new location for each of the magnets and calculates new predicted magnetic field strength values. The iteration process continues until the predicted values match the measured values within a desired degree of tolerance. At this point, the estimated location and orientation of each of the magnets matches the actual location within a predetermined degree of tolerance.",A61B 5/06; A61B 19/00; G01V 3/08,"LUCENT MEDICAL SYSTEMS, INC.","HAYNOR, David, R.; SOMOGYI, Christopher, P.; GOLDEN, Robert, N.; SANDERS, Gary, B.","09/188,049 06.11.1998 US",JP-2000580519; EP-1999956780
WO2015117204,PCT/AU2015/050043,06.02.2015,WO/2015/117204,13.08.2015,WO,"BIOMARKER SIGNATURE METHOD, AND APPARATUS AND KITS THEREFOR","The present invention discloses methods, kits, and apparatus as well as reagents and compositions associated therewith for deriving an indicator for use in diagnosing the presence, absence or degree of at least one condition in a biological subject or in prognosing at least one condition in a biological subject. Also disclosed is a biomarker signature for use in diagnosing the presence, absence or degree of at least one condition in a biological subject or in prognosing at least one condition in a biological subject. The present invention further discloses methods, kits and apparatus, as well as reagents and compositions associated therewith, for identifying biomarkers for use in a biomarker signature.",G06F 19/18; C12Q 1/68; G01N 33/50,IMMUNEXPRESS PTY LTD,"BRANDON, Richard Bruce; MCHUGH, Leo Charles",2014900363 06.02.2014 AU,AU-2015213486; US-15117137; JP-2016550561; EP-2015746053; CA-2930925
WO2018152016,PCT/US2018/017517,09.02.2018,WO/2018/152016,23.08.2018,WO,NATURAL LANGUAGE INTERACTION FOR SMART ASSISTANT,"A smart assistant device includes a storage machine holding instructions executable by a logic machine to record speech provided by a human user. The recorded speech is translated into a machine-readable natural language input relating to an interaction topic. An interaction timer is maintained that tracks a length of time since a last machine-readable natural language input referring to the interaction topic was translated. Based on a current value of the interaction timer being greater than an interaction engagement threshold, a message relating to the interaction topic is delivered with a first natural language phrasing that includes an interaction topic reminder. Based on the current value of the interaction timer being less than the interaction engagement threshold, the message relating to the interaction topic is delivered with a second natural language phrasing that lacks the interaction topic reminder.",G10L 15/22; H04L 12/58,"MICROSOFT TECHNOLOGY LICENSING, LLC","HEROLD, Keith Coleman; SOLOMON, Oz","62/459,020 14.02.2017 US; 62/482,165 05.04.2017 US; 15/656,994 21.07.2017 US",CN-201880011965.7; EP-2018706621
