WO2019032622,PCT/US2018/045676,07.08.2018,WO/2019/032622,14.02.2019,WO,LONG-TERM AND CONTINUOUS ANIMAL BEHAVIORAL MONITORING,"Systems and methods for continuous monitoring of the behavior of animals, such as small rodents, are provided. Monitoring can include video, audio, and other sensor modalities. In one embodiment, the system can include cameras, arena design, environmental sensors, and ultrasonic sensors. The system uniquely provides a continuous long-term monitoring system suitable for mouse behavioral study. Further provided is a neural network based tracker configured for use with video data acquired by the monitoring system. 3 different neural network architectures have been tested to determine their performance on genetically diverse mice under varying environmental conditions. It has been observed that that an encoder- decoder segmentation neural network achieves high accuracy and speed with minimal training data. This general purpose neural network tracker can be easily extended to other experimental paradigms and even to other animals through transfer learning, thus forming a robust, generalizable solution for bio-behavioral research.",A01K 1/03; A01K 11/00; A01K 29/00; G06K 9/46; G06K 9/66,THE JACKSON LABORATORY,"KUMAR, Vivek; GEUTHER, Brian, Q.; PETERSON, Jim; CHURCHILL, Gary","62/661,610 23.04.2018 US; 62/542,180 07.08.2017 US",EP-2018843419
WO1997005553,PCT/US1996/012177,25.07.1996,WO/1997/005553,13.02.1997,WO,COMPUTER ASSISTED METHODS FOR DIAGNOSING DISEASES,"The simultaneous multi access reasoning technology system of the present invention utilizes both existing knowledge and implicit information that can be numerically extracted from training data to provide a method and apparatus for diagnosing disease and treating a patient. This technology further comprises a system for receiving patient data from another location, analyzing the data in a trained neural network, producing a diagnostic value, and optionally transmitting the diagnostic value to another location.",G06F 15/18; G06F 19/00; G06N 3/00; G06Q 50/00,"HORUS THERAPEUTICS, INC.","BARNHILL, Stephen, D.; ZHANG, Zhen","60/001,425 25.07.1995 US; 08/642,848 03.05.1996 US",CN-96196534.7; NZ-315428; JP-1997507712; CA-2227543; EP-1996927247
WO2018179769,PCT/JP2018/002469,26.01.2018,WO/2018/179769,04.10.2018,WO,"EMBRYONIC DEVELOPMENT ANALYSIS SYSTEM, EMBRYONIC DEVELOPMENT IMAGE ANALYSIS METHOD, NON-TRABSITORY COMPUTER READABLE MEDIUM, AND EMBRYONIC DEVELOPMENT ANALYSIS IMAGE PROCESSING DEVICE","There is provided an embryonic development analysis system, including: processing circuitry configured to: recognize a shape of one or more cells represented in one or more of a plurality of embryonic development images captured in a time series; calculate a time-series change of the shape of the one or more cells based on the recognized shape of the one or more cells in the one or more of the plurality of embryonic development images; and calculate a first feature amount based on the calculated time-series change of the shape.",G06K 9/00,SONY CORPORATION,"SHINODA, Masataka; OHASHI, Takeshi; ONUMA, Tomoya",2017-072856 31.03.2017 JP,CA-3056559; CN-201880020491.2; EP-2018705188; AU-2018245711
WO2011005094,PCT/NL2010/050439,08.07.2010,WO/2011/005094,13.01.2011,WO,HIGH THROUGHPUT METHOD AND SYSTEM FOR IN VIVO SCREENING,"Provided is a method and system for screening chemical compounds or compositions, wherein replicating entities are introduced into the yolk of an (un)fertilized egg or embryo. The method may be extended to elucidate the mechanism-of-action of functional chemical compounds or compositions in the same method and system. The method and system may also be employed for identifying marker genes, marker proteins or marker metabolites.",G01N 33/50; C12N 15/89; C12M 3/00,"ZF SCREENS B.V.; UNIVERSITEIT LEIDEN; SPAINK, Herman, Pieter; DIRKS, Ronald, Petronella, Hubertus","SPAINK, Herman, Pieter; DIRKS, Ronald, Petronella, Hubertus","61/223,805 08.07.2009 US; 09164956.6 08.07.2009 EP",EP-2010734358
WO2019100065,PCT/US2018/062057,20.11.2018,WO/2019/100065,23.05.2019,WO,IMAGE SEGMENTATION USING NEURAL NETWORKS,"A method for generating a segmentation of an image that assigns each pixel to a respective segmentation category from a set of segmentation categories is described. The method includes obtaining features of the image, the image including a plurality of pixels. For each of one or more time steps starting from an initial time step and continuing until a final time step, the method includes generating a network input from the features of the image and a current segmentation output as of the time step, processing the network input using a convolutional recurrent neural network to generate an intermediate segmentation output for the time step, and generating an updated segmentation output for the time step from the intermediate segmentation output for the time step and the current segmentation output as of the time step. The method includes generating a final segmentation of the image from the updated segmentation output.",G06N 3/04; G06T 7/11; G06N 3/08,GOOGLE LLC,"SHLENS, Jonathon; MAHESWARANATHAN, Niruban; SUSSILLO, David","62/588,883 20.11.2017 US",
WO2019216975,PCT/US2019/020044,28.02.2019,WO/2019/216975,14.11.2019,WO,"METHODS AND SYSTEMS FOR DATA COLLECTION, LEARNING, AND STREAMING OF MACHINE SIGNALS FOR ANALYTICS AND MAINTENANCE USING THE INDUSTRIAL INTERNET OF THINGS","An industrial machine predictive maintenance system may include an industrial machine data analysis facility that generates streams of industrial machine health monitoring data by applying machine learning to data representative of conditions of portions of industrial machines received via a data collection network. The system may include an industrial machine predictive maintenance facility that produces industrial machine service recommendations responsive to the health monitoring data by applying machine fault detection and classification algorithms thereto. A computerized maintenance management system (CMMS) that produces orders and/or requests for service and parts responsive to the industrial machine service recommendations can be included. The system may include a service and delivery coordination facility that processes information regarding services performed on industrial machines responsive to the orders and/or requests for service and parts, thereby validating the services performed while producing a ledger of service activity and results for individual industrial machines.",G05B 23/02; H04L 5/00; H04B 17/309; H04L 29/08; H04B 17/318; G05B 13/02; G05B 19/418,"STRONG FORCE IOT PORTFOLIO 2016, LLC","CELLA, Charles Howard; DUFFY, JR., Gerald William; MCGUCKIN, Jeffrey P.; DESAI, Mehul","15/973,406 07.05.2018 US; 62/713,897 02.08.2018 US; 62/714,078 02.08.2018 US; 16/143,286 26.09.2018 US; 62/757,166 08.11.2018 US; 62/799,732 31.01.2019 US",
WO1998039721,PCT/US1998/004374,06.03.1998,WO/1998/039721,11.09.1998,WO,METHOD FOR DIAGNOSING AND STAGING PROSTATE CANCER,"The subject invention provides a method for diagnosing prostate cancer and determining preoperatively the pathological stage in patients with prostate cancer. The methods described herein can be used for prediction of margin positivity, seminal vesicle (S.V.) involvement, and lymph nodal (L.N.) involvement in patients with clinically localized prostate cancer. The method includes use of a neural network which provides prostate cancer stage information for a patient based upon input data which includes the patient's preoperative serum PSA, biopsy Gleason score, and systemic biopsy-based information. Its positive predictive value (PPV), negative predictive value (NPV), and accuracy are superior to that of current nomograms in use. Use of this method can result in enormous cost savings by accurately diagnosing patients with prostate cancer and by avoiding multiple imaging tests and expensive surgery in unindicated patients.",A61B 5/06; G06F 19/00,UNIVERSITY OF FLORIDA,"TEWARI, Ashutosh; NARAYAN, Perinchery","60/039,917 07.03.1997 US",EP-1998908989
WO2003045108,PCT/US2002/036261,12.11.2002,WO/2003/045108,30.05.2003,WO,HEARING AIDS AND METHODS AND APPARATUS FOR AUDIO FITTING THEREOF,"A field ready, unsupervised-use ready, method and apparatus for audio fitting a hearing aid is described in a hand held configuration having paired comparison (hearing selections) stored in and derivable from a memory therein. The paired comparisons are presented one at a time to a user and a preferred selection for each paired comparison is made by a select indicator after the user toggles back and forth between the selections for as many times necessary in determining their preferences. A genetic algorithm converges all the preferences upon a single solution. Crossover and mutation genetic algorithm operators operate on a linear range of indexes representative of parametric values of the pairs. A fully integrated hearing aid having all the above described features incorporated therein is also presented.",H04R 25/00,"STARKEY LABORATORIES, INC.; DURANT, Eric, A.","DURANT, Eric, A.","10/001,229 15.11.2001 US; 10/051,757 16.01.2002 US",JP-null; CA-2467352; EP-2002803615
WO2018042232,PCT/IB2016/055288,02.09.2016,WO/2018/042232,08.03.2018,WO,METHOD AND APPARATUS FOR PROVIDING COGNITIVE FUNCTIONS AND FACILITATING MANAGEMENT IN COGNITIVE NETWORK MANAGEMENT SYSTEMS,"Various methods are provided for enabling the application of machine learning to network management and in particular to enabling cognitive network management in radio access networks. One example method may comprise interpreting one or more operator goals for the CNM or for a specific CF to ensure that the specific CF adjusts its behavior in order to fulfil the operator goals, abstracting an environment into states configured for use in subsequent decision making, wherein the abstracted environment represent are built from one or more of a combination of quantitative KPIs, abstract state labels, and operational contexts, defining legal candidate network configurations for different contexts of the CF based on the abstracted environments and operational contexts as inferred by the EMA engine, and matching a current abstract state, abstracted environment, or operational context as derived by the EMA engine to an appropriate network configuration selected from the set of legal candidate network configurations.",H04L 12/24; H04W 84/18,NOKIA TECHNOLOGIES OY; NOKIA USA INC.,"MWANJE, Stephen; MANNWEILER, Christian; SCHMELZ, Lars Christoph",,EP-2016767022; CN-201680090617.4; JP-2019512206; KR-1020197009522
WO2005022350,PCT/US2004/028038,27.08.2004,WO/2005/022350,10.03.2005,WO,METHODS AND SYSTEMS FOR MULTI-PARTICIPANT INTERACTIVE EVOLUTIONARY COMPUTING,"Disclosed are methods, systems, and processor program products that include executing an optimization scheme to obtain a first solution set, presenting the first solution set to at least two users (112B), receiving rankings of the first solution set from the at least two users, aggregating the ranking (114B), and, generating a second solution set based on the aggregating rankings. The optimization scheme can include a genetic algorithm (110, 116B). In embodiments, at least a part of the first solution set can be presented to the users (112B, 112A) based on the parts of the solution set associated with the user (e.g., user’s knowledge).",G06F 15/18; G06N 3/00; G06N 3/12,"ICOSYSTEM CORPORATION; BONABEAU, Eric; FUNES, Pablo","BONABEAU, Eric; FUNES, Pablo","60/498,189 27.08.2003 US; 60/539,230 26.01.2004 US; 10/922,777 20.08.2004 US",EP-2004782505; JP-2006524908; NZ-545205; AU-2004269736
WO2019144231,PCT/CA2019/050087,24.01.2019,WO/2019/144231,01.08.2019,WO,AUTONOMOUS UNMANNED GROUND VEHICLE AND HANDHELD DEVICE FOR PEST CONTROL,"Herein provided is an autonomous unmanned ground vehicle (AUGV) and handheld device for pest control. The AUGV comprises a chassis with a drive mechanism to displace the AUGV among a plurality of plants comprising at least one weed; an image- capture device to obtain images of the plurality of plants; a motorized arm with a free end displaceable with respect to the chassis; a microwave emitter mounted to the free end, displaceable therewith, and operable to emit microwaves; and a control system to operate at AUGV. The control system comprises a processing unit; and a memory having stored thereon instructions to cause the AUGV to perform: independently navigating the chassis among the plurality of plants; identifying the at least one weed in the images; displacing the motorized arm to position the free end in proximity to the at least one weed; and emitting microwaves toward the at least one weed.",A01B 39/06; A01B 1/16; A01B 39/18; A01M 21/04; B25J 19/04; B25J 5/00; B25J 9/18; B60L 53/36; B60L 58/12; G05D 1/02; G01R 31/387; G01N 21/84,ELEOS ROBOTICS INC.,"VAN ESSEN, Yahoel; HO, Gordon","62/622,016 25.01.2018 US",
WO2019016353,PCT/EP2018/069720,20.07.2018,WO/2019/016353,24.01.2019,WO,CLASSIFYING SOMATIC MUTATIONS FROM HETEROGENEOUS SAMPLE,"In order to determine somatic mutations from germline mutations when matched normal sequences may not be available, adaboost machine learning algorithms are developed to classify germline mutations and somatic mutations. Three models were built based on different types of samples. The types samples can include, for example, fresh frozen samples, formalin-fixed paraffin-embedded (FFPE) samples, and plasma samples. The performances of the algorithms are evaluated with either ten-fold cross-validation or tested on independent set of samples.",G06F 19/22; C12Q 1/6869,"F. HOFFMANN-LA ROCHE AG; ROCHE DIAGNOSTICS GMBH; ROCHE SEQUENCING SOLUTIONS, INC.","LAL, Preeti; LAM Y. K., Hugo; LEE, John; LOVEJOY, Alex; PALMA F., Johm; ROSENTHAL, Andre; YAO, Lijing","62/535,727 21.07.2017 US",
WO2020050920,PCT/US2019/043107,23.07.2019,WO/2020/050920,12.03.2020,WO,CONTEXT-AWARE FEATURE EMBEDDING AND ANOMALY DETECTION OF SEQUENTIAL LOG DATA USING DEEP RECURRENT NEURAL NETWORKS,"Techniques are provided herein for contextual embedding of features of operational logs or network traffic for anomaly detection based on sequence prediction. In an embodiment, a computer has a predictive recurrent neural network (RNN) that detects an anomalous network flow. In an embodiment, an RNN contextually transcodes sparse feature vectors that represent log messages into dense feature vectors that may be predictive or used to generate predictive vectors. In an embodiment, graph embedding improves feature embedding of log traces. In an embodiment, a computer detects and feature-encodes independent traces from related log messages. These techniques may detect malicious activity by anomaly analysis of context-aware feature embeddings of network packet flows, log messages, and/or log traces.",G06N 3/04; H04L 29/06; G06N 3/08; G06N 5/02,ORACLE INTERNATIONAL CORPORATION,"HAJIMIRSADEGH, Hossein; ZHOU, Guang-Tong; BROWNSWORD, Andrew; AGARWAL, Nipun; CHANDRASHEKAR, Pavan; NIA, Karoon Rashedi","16/122,505 05.09.2018 US",
WO2019103836,PCT/US2018/059304,06.11.2018,WO/2019/103836,31.05.2019,WO,SENSOR DATA SEGMENTATION,"A system may include one or more processors configured to receive a plurality of images representing an environment. The images may include image data generated by an image capture device. The processors may also be configured to transmit the image data to an image segmentation network configured to segment the images. The processors may also be configured to receive sensor data associated with the environment including sensor data generated by a sensor of a type different than an image capture device. The processors may be configured to associate the sensor data with segmented images to create a training dataset. The processors may be configured to transmit the training dataset to a machine learning network configured to run a sensor data segmentation model, and train the sensor data segmentation model using the training dataset, such that the sensor data segmentation model is configured to segment sensor data.",G06K 9/00,"ZOOX, INC.","PFEIFFER, David","15/820,245 21.11.2017 US",
EP13349843,99309933,10.12.1999,1008952,14.06.2000,EP,System and method for identifying the geographic origin of a fresh commodity,"The detection method includes generating a plurality of neural network models. Each model has as a training set a data set from a plurality of samples of a commodity of known origins. Each sample has been analyzed for a plurality of elemental concentrations. Each neural network model is presented for classification a test data set from a plurality of samples of a commodity of unknown origins. As with the training set, the samples have been analyzed for the same plurality of elemental concentrations. Next a bootstrap aggregating strategy is employed to combine the results of the classifications for each sample in the test data set made by each neural network model. Finally, a determination is made from the bootstrap aggregating strategy as to a final classification of each sample in the test data set. This final classification is indicative of the geographical origin of the commodity. The system includes software for generating the neural network models and a software routine for performing the bootstrap aggregating strategy. <IMAGE>",G06K 9/62; G06N 3/04,FLORIDA DEPT OF CITRUS; FLORIDA DEPT OF CITRUS AND IDA,ANDERSON KIM A; SMITH BRIAN; MAGNUSON BERNADENE,21035898 11.12.1998 US,
WO2003025858,PCT/CA2002/001400,16.09.2002,WO/2003/025858,27.03.2003,WO,METHOD FOR IDENTIFYING AND QUANTIFYING CHARACTERISTICS OF SEEDS AND OTHER SMALL OBJECTS,"The invention provides a method for identifying or quantifying characteristics of interest of unknown objects, comprising training a single neural network model with training sets of known objects having known values for the characteristics; validating the optimal neural network model; and analyzing unknown objects having unknown values of the characteristics by imaging them to obtain a digital image comprising pixels representing the unknown objects, background and any debris; processing the image to identify, separate, and retain pixels representing the unknown objects from pixels and to eliminate background and debris; analyzing the pixels representing each of the unknown objects to generate data representative of image parameters; providing the data to the flash code deployed from the candidate neural network model; analyzing the data through the flash code; and receiving output data (the unknown values of the characteristics of interest of the unknown objects) from the flash code in a predetermined format.",G06K 9/00; G06T 7/00; G06T 7/60,"HER MAJESTY THE QUEEN IN RIGHT OF CANADA as represented by THE MINISTER OF AGRICULTURE AND AGRI-FOOD; KOKKO, Eric, Gerard; HILL, Bernard, Dale","KOKKO, Eric, Gerard; HILL, Bernard, Dale","60/323,044 17.09.2001 US; 60/338,018 02.11.2001 US",AU-2002328213; JP-null; GB-GB0408593.2; CA-2459558; EP-2002762171
WO2020018463,PCT/US2019/041887,15.07.2019,WO/2020/018463,23.01.2020,WO,BIOMARKERS AND TEST MODELS FOR CHRONIC KIDNEY DISEASE,"The presently disclosed subject matter relates to methods of determining a feline's susceptibility to developing chronic kidney disease (CKD) and to methods of preventing and/or reducing a risk of developing CKD for a feline. In certain embodiments, the biomarkers comprise creatinine, urine specific gravity or urea.",G01N 33/68; G01N 33/70,"MARS, INCORPORATED","BRADLEY, Richard; TAGKOPOULOS, Ilias; BIOURGE, Vincent; FEUGIER, Alexandre; DELMOTTE, Sebastien; WATSON, Phillip","62/858,771 07.06.2019 US; 62/698,046 14.07.2018 US",
WO2020051351,PCT/US2019/049777,05.09.2019,WO/2020/051351,12.03.2020,WO,SEIZURE DETECTION SYSTEM IN MOBILE SUBJECTS,An electrode for use in ambulatory BEG signal collection includes an electrode contact comprising a gelatin or hydrogel polymer having low input impedance. The electrode contact retains adhesive ability and low input impedance over long periods of time. A system using the electrode includes circuits and software for analyzing EEG signals to detect and report ictal events in real time. At least part of the system is wearable; and advantageously part of the system resides in a cloud based system. A signal analyzer incorporated in the system provides real time ictal signal identification through physical graphing and cross-correlation. In some aspects the analyzer also provides confirmation of ictal signal identification by physical graphing and machine deep learning. Analysis of physical graphs may conveniently be performed using a graphics processing unit to speed processing.,A61B 5/00; A61B 5/04; A61B 5/0478; C08L 101/12; H01B 1/12; H01M 4/02,"KORWAVE, LLC","MCFARLAND, Patrick, S.","62/728,568 07.09.2018 US",
WO2016011563,PCT/CA2015/050710,27.07.2015,WO/2016/011563,28.01.2016,WO,SYSTEM AND METHOD FOR PROCESS CONTROL OF GENE SEQUENCING,"Systems, methods and computer-readable media are provided for determining the amount of sequencing required to achieve a target sequencing quality of a genetic sample to be sequenced. The method comprises receiving a genetic sample and sequencing a portion of the genetic sample. A sequencing quality metric belonging to a category of sequencing quality metrics is generated from the sequencing. The amount of sequencing of the genetic sample required to achieve the target sequencing quality is determined by inputting the sequencing quality metric into a trained model. A system is also disclosed for genetic sequencing. Corresponding methods and computer-readable media are also provided.",G06F 19/10; C12M 1/34; C12Q 1/68; G06F 19/22,ONTARIO INSTITUTE FOR CANCER RESEARCH,"BOUTROS, Paul C.; CHONG, Lauren; LALANSINGH, Christopher; ALBUQUERQUE, Marco","62/029,112 25.07.2014 US",CA-2955147
WO2020001914,PCT/EP2019/064052,29.05.2019,WO/2020/001914,02.01.2020,WO,METHODS AND APPARATUS FOR ASSESSING EMBRYO DEVELOPMENT,"A computer-implemented method of processing a time series of images of an embryo to determine estimated timings for a plurality of developmental events for the embryo, wherein the method comprises: determining feature information for each of the images, the feature information for each image representing the content of the image; establishing machine learned classifiers for associating each of the images with a respective likelihood of the image being associated with (i.e. representing) one or more of the plurality of developmental events based on the feature information for the image; applying the machine learned classifiers to the feature information for each of the images to determine a respective likelihood of the image being associated with one or more of the plurality of developmental events; and determining estimated timings for the plurality of developmental events for the embryo from the respective likelihoods of the respective images being associated with respective ones of the plurality of developmental events. The method may further comprise determining an indication of a confidence estimate for the timings.",G06K 9/00,VITROLIFE A/S,"RIMESTAD, Jens; BERNTSEN, Jørgen; HANSEN, Michael Sass; KRAAIJENZANK, Sebastian Gerrit Jan Brandes",1810634.4 28.06.2018 GB,
WO2017132674,PCT/US2017/015645,30.01.2017,WO/2017/132674,03.08.2017,WO,AUTOMATED IMAGE ANALYSIS TO ASSESS REPRODUCTIVE POTENTIAL OF HUMAN OOCYTES AND PRONUCLEAR EMBRYOS,"A computer system automatically converts a set of training images of cells (e.g., oocytes or pronuclear embryos) and related outcome metadata into a description document by extracting features (e.g., cytoplasm features) from the pixel values of the training images that describe the cells and associating the extracted features with the outcome metadata. Based on the description document, the system automatically computes a decision model that can be used to predict outcomes of new cells. To predict outcomes of new cells, a computer system automatically extracts features from images that describe the new cells and predicts one or more outcomes by applying the decision model. The features extracted from the images that describe the new cells correspond to features selected for inclusion in the decision model, and are calculated in the same way as the corresponding features extracted from the training images.",G06K 9/00,"LETTERIE, Gerard; MACDONALD, Andrew","LETTERIE, Gerard; MACDONALD, Andrew","62/288,379 28.01.2016 US",CA-3013048; EP-2017745088; US-16073126; JP-2018559173
EP193698855,16187857,08.09.2016,3147799,29.03.2017,EP,SIMILARITY-BASED DETECTION OF PROMINENT OBJECTS USING DEEP CNN POOLING LAYERS AS FEATURES,"A system and method provide object localization in a query image based on a global representation of the image generated with a model derived from a convolutional neural network. Representations of annotated images and a query image are each generated based on activations output by a layer of the model which precedes the fully-connected layers of the neural network. A similarity is computed between the query image representation and each of the annotated image representations to identify a subset of the annotated images having the highest computed similarity. Object location information from at least one of the subset of annotated images is transferred to the query image and information is output, based on the transferred object location information.",G06F 17/30; G06K 9/62; G06N 3/04; G06T 7/10,XEROX CORP,RODRIGUEZ-SERRANO JOSE-ANTONIO; GORDO SOLDEVILA ALBERT,201514861386 22.09.2015 US,
