WO2016014137,PCT/US2015/029438,06.05.2015,WO/2016/014137,28.01.2016,WO,"APPARATUSES, METHODS, AND SYSTEMS FOR DEFINING HARDWARE-AGNOSTIC BRAINS FOR AUTONOMOUS ROBOTS","Conventionally, robots are typically either programmed to complete tasks using a programming language (either text or graphical), shown what to do for repetitive tasks, or operated remotely by a user. The present technology replaces or augments conventional robot programming and control by enabling a user to define a hardware-agnostic brain that uses Artificial Intelligence (AI) systems, machine vision systems, and neural networks to control a robot based on sensory input acquired by the robot's sensors. The interface for defining the brain allows the user to create behaviors from combinations of sensor stimuli and robot actions, or responses, and to group these behaviors to form brains. An Application Program Interface (API) underneath the interface translates the behaviors' inputs and outputs into API calls and commands specific to particular robots. This allows the user to port brains among different types of robot to robot without knowing specifics of the robot commands.",G06N 3/08,"NEURALA, INC.; GORCHETCHNIKOV, Anatoli; AMES, Heather Marie","GORCHETCHNIKOV, Anatoli; AMES, Heather Marie; VERSACE, Massimiliano; MATUS, Roger; DEFREITAS, Alexandrea; AMADEO, Mike; SEEMANN, Tim; MARSH, Ethan","61/989,332 06.05.2014 US",
WO1995026008,PCT/US1995/003624,22.03.1995,WO/1995/026008,28.09.1995,WO,DETECTING AND CLASSIFYING CONTAMINANTS IN WATER,"A method and apparatus for a remote environmental monitoring system (EMS) (14) designed to sample, detect, measure, and report in real time to a user (12) the presence of contaminants, e.g. pollution, in water (20b) and thereby monitor the conformance of water (20b) with established health and safety standards. When the EMS (14) is integrated with a process control system (268, 270) it provides feedback to the process control system (268, 270) to ensure that the sampled water (20b) conforms to established health and safety standards.",C02F 1/00; G01N 33/18,INTELLIGENT MONITORING SYSTEMS,"MOTRON, Stephen, G.","08/216,643 22.03.1994 US",
WO2018162778,PCT/ES2018/070167,07.03.2018,WO/2018/162778,13.09.2018,WO,"METHOD, SYSTEM, COMPUTER SYSTEM AND COMPUTER PROGRAM FOR GENERATING DATA REGARDING A PREDICTION OF THE STOCK OF AN AGRICULTURAL PRODUCT","The invention relates to a method, system, computer system and computer program for generating data regarding a prediction of the stock of an agricultural product that has a life cycle. The method comprises: receiving historic data corresponding to parameters of the life cycle and to stock that was produced under said parameters; generating training data from the historical data; performing a machine learning method using the training data to fit a “predictive” software program; receiving current data corresponding to parameters of the life cycle; and providing the current data to the predictive software to generate the corresponding stock prediction. The historical data include data from sensors of a farm that produced the product. The current data include data from sensors of a farm that is producing the product. The historical/current data can also correspond to, for example, parameters of the productive process and of the producer, and climatic, economic, phytopathological, logistic and commercial parameters, etc.",G06F 17/00; G06N 3/00,EASYTOSEE AGTECH SOCIEDAD LIMITADA,"ARJONA ANTOLÍN, Ricardo; CARRILLO DONAIRE, Pedro; ASENCIO CORTÉS, Gualberto; MOLINA CABANILLAS, Miguel Ángel",P201730306 08.03.2017 ES,
WO2008077635,PCT/EP2007/011392,21.12.2007,WO/2008/077635,03.07.2008,WO,DETERMINATION AND PREDICTION OF THE EXPRESSION OF TRAITS OF PLANTS FROM THE METABOLITE PROFILE AS A BIOMARKER,"The present invention relates to a method for determining the correlation between the metabolite profiles (MPs) and the expression or potential for expression of a trait of a group of plants, and further to a method for determining or predicting the expression of a trait of a plant by taking advantage of the determined MP of said plant and a determined correlation between the MPs and the expression or potential for the expression of said trait in a group of plants. Particularly, the present invention relates to a method for determining or predicting the biomass production/growth rate of a plant by taking advantage of the determined MP of said plant and a determined correlation between the MPs and the biomass production/growth rate or the potential for biomass production/growth rate of a group of plants. The present invention also relates to a method for breeding of a plant that takes advantage of a method of determining the expression or potential for expression of a trait of said plant according to any one of the methods as disclosed, and selecting said plant on the basis of the expression or potential for expression of said trait. Furthermore, the present invention relates to a method for identifying quantitative trait loci (QTLs) for a trait or for the potential for expression of a trait of a group of plants comprising the step of identifying QTLs for metabolite combinations showing correlation with the expression or potential for expression of said trait of said group of plants. The present invention also relates to and a method for identifying a candidate gene involved in the determination of expression or potential for expression of a trait of a plant comprising the step of isolating a gene corresponding to any one of the QTLs as identified by the corresponding method of the present invention. Additionally, the present invention relates to a method of screening for a plant that exhibits a desired expression or potential for expression of a trait as well as to a method of determining whether a treatment influences the expression or potential for expression of a trait of a plant.",G01N 30/72; G01N 33/50,"MAX-PLANCK-GESELLSCHAFT ZUR FÖRDERUNG DER WISSENSCHAFTEN E.V.; ALTMANN, Thomas; WILLMITZER, Lothar; SELBIG, Joachim; MEYER, Rhonda, C.; STEINFATH, Matthias; LISEC, Jan; FIEHN, Oliver","ALTMANN, Thomas; WILLMITZER, Lothar; SELBIG, Joachim; MEYER, Rhonda, C.; STEINFATH, Matthias; LISEC, Jan; FIEHN, Oliver",06026785.3 22.12.2006 EP,EP-2007857099; US-12520845; CA-2673603
WO2009144725,PCT/IL2009/000532,27.05.2009,WO/2009/144725,03.12.2009,WO,CARBON NANOTUBE STRUCTURES IN SENSOR APPARATUSES FOR ANALYZING BIOMARKERS IN BREATH SAMPLES,"The present invention provides a system for measuring biomarker analytes indicative of various diseases comprising an array of sensors sensitive to volatile organic compounds. Particularly, the system is composed of a random network of single-walled carbon nanotubes (SWCNTs) coated with non-polar small organic molecules in conjunction with learning and pattern recognition algorithms. Methods of discriminating between breath samples of healthy individuals and of lung cancer patients are disclosed.",G01N 33/497,"TECHNION RESEARCH AND DEVELOPMENT FOUNDATION LTD.; HAICK, Hossam; GANG, Peng","HAICK, Hossam; GANG, Peng","61/056,841 29.05.2008 US",US-12994177; EP-2009754344
WO2019106638,PCT/IB2018/059568,03.12.2018,WO/2019/106638,06.06.2019,WO,SYSTEMS AND METHODS FOR SORTING OF SEEDS,A system for categorizing seeds of plants into hybrid and non-hybrid categories. Seeds sorted according to the disclosed system are also disclosed.,G06K 9/00; G06K 9/20; G06K 9/46; G06K 9/62; B07C 5/34,SEEDX TECHNOLOGIES INC.,"SHNIBERG, Mordekhay; CARMON, Elad; ASHKENAZY, Sarel; GEDALYAHO VAISBERGER, David; AYAL, Sharon","62/593,949 03.12.2017 US; 62/712,270 31.07.2018 US; 62/712,264 31.07.2018 US",
WO2007059119,PCT/US2006/044170,13.11.2006,WO/2007/059119,24.05.2007,WO,SYSTEMS AND METHODS FOR IDENTIFYING DIAGNOSTIC INDICATORS,"Systems and methods are provided for predicting patient response to a therapy regimen for a liver disease or a disease that is treatable with an immunomodulatory disease therapy using gene expression classifiers. Systems and methods for screening for modulators of target gene expression are also provided. Systems and methods for developing therapeutics against one or more of the proteins coded for by genes of the present invention are also provided. Systems and methods for predicting a patient response to a regimen of interferon either alone or in conjuction with one or more therapeutic molecules, such as ribavirin, in a therapy for hepatitis C viral infection are also provided.",G01N 33/48,"BOROZAN, Ivan; CHEN, Limin; EDWARDS, Aled, M.; HEATHCOTE, Elizabeth, J.; MCGILVRAY, Ian, D.","BOROZAN, Ivan; CHEN, Limin; EDWARDS, Aled, M.; HEATHCOTE, Elizabeth, J.; MCGILVRAY, Ian, D.","60/735,567 11.11.2005 US",
WO2006002240,PCT/US2005/022071,20.06.2005,WO/2006/002240,05.01.2006,WO,COMPUTER SYSTEMS AND METHODS FOR CONSTRUCTING BIOLOGICAL CLASSIFIERS AND USES THEREOF,"The present invention provides systems and method for constructing classifiers that distinguish between trait subgroups using molecular marker data from blood samples. The invention further encompasses the use of the classifiers and combinations of molecular markers identified by the classifiers in a wide variety of applications including: diagnosis; prognosis; prediction of disease, stage of disease or disease risk; monitoring disease progression and/or regression; monitoring disease reoccurrence and identifying risk of disease reoccurrence; determining and/or predicting response to treatment and/or treatment outcomes; monitoring and/or predicting treatment compliance or non compliance and the like. The invention further provides a variety of selected molecular markers and a means to identify combinations of the selected molecular markers useful for diagnosing particular traits of interest.",C12Q 1/00; G01N 33/48,"CHONDROGENE, INC.; LIEW, Choong-Chin; YAGER, Tom; DEMPSEY, Adam; CHAO, Samuel","LIEW, Choong-Chin; YAGER, Tom; DEMPSEY, Adam; CHAO, Samuel","60/581,312 19.06.2004 US; 60/581,977 21.06.2004 US; 60/643,475 12.01.2005 US; 60/663,722 22.03.2005 US",US-10568264; CA-2571180; EP-2005766673; DE-null
EP251063984,17867803,18.10.2017,3530725,28.08.2019,EP,"INFORMATION PROCESSING DEVICE, INFORMATION PROCESSING METHOD AND INFORMATION PROCESSING SYSTEM",[Problem] To discriminate a phenomenon relating to a biological sample at a higher accuracy. [Solution] An information processing device comprising: a first information acquisition section for acquiring first information on the basis of a still image of a biological sample in a frame corresponding to a preset time from among a plurality of images thereof picked up in time series; a second information acquisition section for acquiring second information on the basis of changes among the frames of the plurality of images within a preset period of time; and a determination section for determining a phenomenon relating to the biological sample with the use of the first information and the second information.,C12M 1/34; G06K 9/00; G06T 1/00; G06T 7/00; G06T 7/20; H04N 1/21,SONY CORP,MURATA REI; WATANABE SHINJI,2016215195 02.11.2016 JP; 2017037683 18.10.2017 JP; 2017184807 26.09.2017 JP,
WO2012122347,PCT/US2012/028215,08.03.2012,WO/2012/122347,13.09.2012,WO,"A METHOD, SYSTEM AND PROGRAM FOR IMPROVED HEALTH CARE",A platform accessible by a user from a web browser/HMO's electronic medical record (EMR) for providing the user with information regarding a patient's drag regimen as well as generating alerts concerning potential adverse effects to a patient from taking a cluster including a plurality of pharmaceutical preparations and various food supplements/herbals may be in data communication with and configured to obtain information from at least two databases and at least one tool for processing the cluster of pharmaceutical preparations in accordance with the information to generate the alerts to the user.,G06F 19/00,"TEVA PHARMACEUTICAL INDUSTRIES LTD.; TEVA PHARMACEUTICALS USA, INC.; SHILOH, Roni","SHILOH, Roni","61/451,544 10.03.2011 US",EP-2016151304; EP-2012711061; US-14000976; CA-2829100; CN-201280021804.9; JP-2013557851; AU-2012225433; IL-224957
WO1999012118,PCT/AU1998/000715,03.09.1998,WO/1999/012118,11.03.1999,WO,COMPOUND SCREENING SYSTEM,"The present application relates to a number of aspects of a compound and/or molecular screening system, including: 1) finding relationships between molecular structure and useful properties of molecules, more particularly using a virtual or mathematical analogue or model of a biological receptor or active site (a 'virtual receptor') or other biological activity, such as toxicity; 2) creating a virtual receptor by use of Minimum Message Length or Maximum Entropy method (MEM) principles such as by applying a Bayesian regularised artificial neural network (BRANN); 3) using a virtual receptor to screen a database, the database may be real or virtual, may apply to existing or hypothetical molecules or compounds; 4) use of virtual receptors as fitness functions; 5) a method of mutating structures by modifying a SMILES string representation; 6) an improved molecular multipole moment representation; 7) an improved molecular eigenvalue index as a representation. Other aspects are also disclosed.",B01J 19/00; G06F 17/50,"COMMONWEALTH SCIENTIFIC AND INDUSTRIAL RESEARCH ORGANISATION; MONASH UNIVERSITY; WINKLER, David, Alan; BURDEN, Frank, Robert","WINKLER, David, Alan; BURDEN, Frank, Robert",PO 8921 03.09.1997 AU; PP 1192 31.12.1997 AU,EP-1998941143; US-09486930
WO1995025273,PCT/SE1995/000268,17.03.1995,WO/1995/025273,21.09.1995,WO,METHODS AND DEVICES FOR AUTOMATIC ASSESSMENT OF CORN,"The flour yield, protein content and bulk density of cereal kernels can be determined by producing images of the cereal kernels, at least one colour parameter and/or at least one geometric parameter are determined for the cereal kernels, and input signals to a neural network are produced by means of the colour parameter and/or the geometric parameter. If the neural network is trained in some suitable manner, it can determine the flour yield, protein content and bulk density on the basis of the input signals.",G01N 21/85; G01N 33/10,"AGROVISION AB; ÖSTE, Rickard; EGELBERG, Peter; PETERSON, Carsten; SVENSSON, Eivor; MÅNSSON, Olle","ÖSTE, Rickard; EGELBERG, Peter; PETERSON, Carsten; SVENSSON, Eivor; MÅNSSON, Olle",9400919-8 17.03.1994 SE,EP-1995913471; US-08714095
WO2019211178,PCT/EP2019/060704,26.04.2019,WO/2019/211178,07.11.2019,WO,METHODS AND SYSTEMS FOR AUTOMATIC OBJECT RECOGNITION AND AUTHENTICATION,"The present invention relates to the field of tracing and anti-counterfeit protection of objects, e.g. products,and particularly to an automatic recognition and authentication of such objects.Specifically, the invention relates to a system and a method of receiving object data representing one or more discriminating characteristics of a physical object or group of physical objects. The method comprises: processing the object data by means of a machine-learning-based object recognition process to obtain discriminating data representing one or more collision resistant virtual representations of the physical object or group of physical objects; comparing at least one of the discriminating data and an original hash value derived therefrom by application of a pre-determined cryptographic hash function thereto with corresponding reference data stored in one or more data repositories with restricted access; and, if said comparison with the reference data results in a match, outputting digitally signed identification data comprising said hash value. Potential applications of the invention comprise particularly object authenticity checks for track & trace and anti- counterfeiting purposes, for example without limitation in the fields of automotive/aerospace spare parts, 3D-printed objects,pharmaceutical products or other health-related products, such health-care products, lab disposables, and clinical test disposables.",G06K 9/00; H04L 9/32; G06K 9/62,MERCK PATENT GMBH,"ENDRESS, Thomas; SZABO, Daniel; BERKERMANN, Frederic",18170047.7 30.04.2018 EP,
WO2013162944,PCT/US2013/036722,16.04.2013,WO/2013/162944,31.10.2013,WO,METHODS FOR DETERMINING PHOTOPROTECTIVE MATERIALS,"This invention provides methods for quantification of photoprotective performance of packaging concepts in an accelerated timeframe. The methods can be used to generate models for the prediction of photoprotective performance values of untested materials based upon some other known qualitative or quantitative property. The methods use a light source which provides a light beam that impinges upon a photoprotective material (28) before being transmitted to a sample cell (44) comprising a photosensitive entity, such as a photosensitive nutrient.",G01N 17/00; G01N 33/02; G01N 33/15; G01N 21/59,E. I. DU PONT DE NEMOURS AND COMPANY,"JERNAKOFF, Peter; NIEDENZU, Philipp, Martin; STANCIK, Cheryl, Marie; MILONE, Michael, Patrick","61/639,309 27.04.2012 US",
WO2004083451,PCT/AU2004/000327,17.03.2004,WO/2004/083451,30.09.2004,WO,ANALYSIS METHOD,"A method of determining a signature indicative of an entity having a condition, the method comprising the steps of: (a) obtaining at least two distinct data sets, at least one of the data sets containing information on at least one characteristic of at least one entity having the condition; and (b) processing the information from the data sets to obtain a signature that is indicative of an entity having the condition.",C12Q 1/00; G01N 33/48; G06F 19/00,"COMMONWEALTH SCIENTIFIC AND INDUSTRIAL RESEARCH ORGANISATION; THOMAS, Mervyn; KIIVERI, Harri; MITCHELL, David","THOMAS, Mervyn; KIIVERI, Harri; MITCHELL, David",2003901196 17.03.2003 AU,
WO2017066851,PCT/AU2016/095007,21.10.2016,WO/2017/066851,27.04.2017,WO,INFERENCING LEARNING AND UTILISATION SYSTEM AND METHOD,"An automatic system and method for the performance of scientific inferencing including the determination of a null hypothesis significance testing on an interactive computer system, the method including the steps of: (a) providing for the input of an input description of a proposed hypothesis test, the input description including a number of relevant input parameters; (b) utilising the computational system for processing the input description into a null hypothesis significance test; (c) executing the null hypothesis significance test on the computational system; and (d) visually displaying the results of the execution.",G06N 5/04; G06F 17/28,"MONSON, Ronald Christopher","MONSON, Ronald Christopher",2015904318 21.10.2015 AU,EP-2016856506; US-15769530; AU-2016343300
WO1999067627,PCT/US1999/014089,22.06.1999,WO/1999/067627,29.12.1999,WO,POLYMER/PLASTICIZER BASED SENSORS,"This invention relates to a novel class of vapor sensors with tunable properties. More particularly, this invention relates to vapor sensors modified by the addition of a compatible small molecule of low volatility, i.e., a plasticizer. In certain aspects, the invention relates to a sensor for detecting an analyte in a fluid comprising: an organic polymer; a plasticizer combined with the organic polymer; and detector operatively associated with the organic polymer.",G01N 27/12; G01N 33/00,"CALIFORNIA INSTITUTE OF TECHNOLOGY; GRUBBS, Robert; MATZGER, Adam, J.; LEWIS, Nathan, S.","GRUBBS, Robert; MATZGER, Adam, J.; LEWIS, Nathan, S.","60/090,412 23.06.1998 US",EP-1999930562; JP-2000556235
WO2009064868,PCT/US2008/083383,13.11.2008,WO/2009/064868,22.05.2009,WO,BIOAEROSOL MEASUREMENY SYSTEM,"A bioaerosol measurement system receives air having entrained particles of an aerosol. It analyzes these particles and drying these particles and illuminates them. Fluorescence spectra of the particles are determined. The particles are also illuminated with polarized light, amount and polarization of backscattered light is determined. A particle size distribution of the particles is also determined. Measured fluorescence spectra, backscatter data, and particle sizes are used to classify the aerosol. In embodiments, hygroscopicity of the particles is also determined and used to help classify the aerosol. In embodiments, the classifying is done by using a neural network previously trained with data representative of a variety of aerosols.",G01N 21/64; G01N 21/25; G01N 33/48,"DROPLET MEASUREMENT TECHNOLOLIES; BAUMGARDNER, Darrel","BAUMGARDNER, Darrel","60/988,013 14.11.2007 US",
WO2007008583,PCT/US2006/026328,07.07.2006,WO/2007/008583,18.01.2007,WO,IMPROVED PROTEIN EXPRESSION COMPARISON ASSAY RESULTS AND APPLICATIONS,The invention proves a method and means to produce protein expression comparison assay results and for using the improved protein expression comparison results for producing improved results for any other application which utilizes said improved protein expression results.,G01N 33/48; C12Q 1/00,"KOHNE, David, E.","KOHNE, David, E.","60/697,118 07.07.2005 US",EP-2006786471; DE-null
WO2019118147,PCT/US2018/062384,23.11.2018,WO/2019/118147,20.06.2019,WO,SPEECH PARSING WITH INTELLIGENT ASSISTANT,A method to execute computer-actionable directives conveyed in human speech comprises: receiving audio data recording speech from one or more speakers; converting the audio data into a linguistic representation of the recorded speech; detecting a target corresponding to the linguistic representation; committing to the data structure language data associated with the detected target and based on the linguistic representation; parsing the data structure to identify one or more of the computer-actionable directives; and submitting the one or more of the computer-actionable directives to the computer for processing.,G10L 15/22; G10L 17/06; G10L 15/08; G10L 17/18,"MICROSOFT TECHNOLOGY LICENSING, LLC","FINKELSTEIN, Erich-Soren; FUNG, Han Yee Mimi; UZELAC, Aleksandar; SOLOMON, Oz; HEROLD, Keith Coleman; PRADEEP, Vivek; LIU, Zongyi; KOISHIDA, Kazuhito; ALBADAWI, Haithem; BATHICHE, Steven Nabil; NUESMEYER, Christopher Lance; HOLTMANN, Michelle Lynn; QUIRK, Christopher Brian; SALA, Pablo Luis","62/597,297 11.12.2017 US; 16/005,470 11.06.2018 US",
WO2017130184,PCT/IL2017/050004,01.01.2017,WO/2017/130184,03.08.2017,WO,SYSTEMS AND METHODS FOR DETECTING IMAGED CLOUDS,"A computer-implemented method for identifying clouds in a digital image, comprising pixels, of a scene, the method comprising quantifying pixel-level characteristic/s in each of a multiplicity of pixels within a digital image of a scene; comparing function/s of the pixel-level characteristic/s to threshold/s thereby to generate comparison result/s; and using a controller for generating an output identifying clouds in the digital image, including identifying presence of cloudiness at at least one first pixel in the digital image, at least partly because the at least one comparison result indicates that the first pixel falls below the threshold/s, and identifying absence of cloudiness at at least one second pixel in the digital image, at least partly because the at least one comparison result indicates that the second pixel exceeds the threshold/s.",G06T 7/00,ISRAEL AEROSPACE INDUSTRIES LTD.,"FEINGERSH, Tal",243846 28.01.2016 IL,SG-11201804949Y; US-16069021; CA-3008810; EP-2017743838
EP254135785,19177505,25.04.2013,3550283,09.10.2019,EP,METHOD FOR PREDICTING THE PHOTOPROTECTIVE PERFORMANCE OF A PACKAGE MATERIAL,,G01N 17/00; G01N 21/59; G01N 33/02; G01N 33/15,CHEMOURS CO FC LLC,JERNAKOFF PETER; NIEDENZU PHILIPP MARTIN; STANCIK CHERYL MARIE; MILONE MICHAEL PATRICK,13720720 25.04.2013 EP; 201261639309 27.04.2012 US; 2013038205 25.04.2013 US,
WO2019144287,PCT/CN2018/073864,23.01.2018,WO/2019/144287,01.08.2019,WO,SYSTEMS AND METHODS FOR AUTOMATIC WATER SURFACE AND SKY DETECTION,"Systems and methods for processing images to detect a water surface (404) and/or a sky (402) in one or more of the images. In some embodiments, the systems and methods may obtain image information for an image (902) and determine whether the image information represents a sky (402) based on a classification model (906). In some embodiments, the systems and methods may detect a first edge line (504) in a first image (602), detect a second edge line (504) in a second image (604), and detect a water surface (404) in the images based on comparing a difference between the first and second edge lines (504) with a threshold value (606). According to further embodiments, the systems and methods may detect whether an image includes a water surface (404) or a sky (402), and if so, determine a movement parameter for a movable object (10) based on whether a water surface (404) or sky (402) is detected.",G05D 1/10; G06K 9/46; G06T 7/20,"SZ DJI TECHNOLOGY CO., LTD.","ZHOU, You; CAI, Jianzhao; TANG, Ketan",,
WO2020051620,PCT/AU2019/000057,16.05.2019,WO/2020/051620,19.03.2020,WO,AUTOMATED VEHICLE,The present invention relates to an automated vehicle comprising a vision system comprising at least one vision sensor to detect a terrain; a manipulator comprising an effector configured for performing an outdoor activity in the terrain; and an arm configured to position the effector in the vicinity of a feature of the terrain and at least one control unit which utilises scanned terrain data from the vision system to improve movement of the automated vehicle and the manipulator during use.,G05D 1/02; G05B 19/42; G06K 9/52; B25J 5/00; B25J 9/16; A01D 46/30,UNIVERSAL FIELD ROBOTICS PTY LTD,"STERLING, Jeffrey James; MCKERCHER, Rhys Andrew; CASSELL, Timothy",2018901710 16.05.2018 AU,
